1,The impeachment machine has been warmed up IT S TITS UP FOR TRUMP Trump AmericaFirst liberal resist CNN
1,MAGA AmericaFirst MAKEAMERICAGREATAGAIN BANZIONISM BILDERBERG Trump Putin Chabad Exposed Secret 2017 Meet
1,Just 1321 days 11 hours 10 minutes 37 seconds left in office AmericaFirst
1,CONGRESS IN ACTION AmericaFirst Stop illegalimmigration securetheborder BuildTheWall
1,MAGA AmericaFirst MAKEAMERICAGREATAGAIN BANZIONISM Mark Anderson Chris Dorsey Prove Bilderberg Treason
1,MAGA AmericaFirst BANZIONISM The BILDERBERG GROUP Indicted By Virginia Militia
1,Third Senate Democrat Sen Joe Donnelly announces support for more US military funding AmericaFirst USA MAGA brexit
1,Again today was a good day for President Trump MAGA AmericaFirst ComeyDay
1,MAGA AmericaFirst MAKEAMERICAGREATAGAIN Chabad Comey Trump Putin GRU FBI NSA Partners In Crime
1,lol won 306 to 232 maga AmericaFirst winning while Harris and warner whine
1,BREAKING DURING COMEY S TESTIMONY TRUMP MAKES HUGE 4 WORD ANNOUNCEMENT AmericaFirst
1,POTUS This is our President Got it Let him do his work for the americafirst Stop the BS and wake up to the TRUTH
1,Finally ONE of them admitted the plan on taking us Nazi Fascist Trump supporters down AmericaFirst MAGA tcot FoxNews FridayFeeling
1,Would TheresaMay pound UK stocks have fared better if AmericaFirst cheerleader for Brexit had made
1,President Trump It s Time to Rebuild Our Country AmericaFirst MAGA
1,Sending message of to my You are a brave man TrumpTrain DrainTheSwamp DeepState MAGA AmericaFirst
1,Just a moment please Japanese will assassinate Trump  FuckTrump FuckAmericaGreatAgain usausa AmericaFirst FUCK
1,House approves legislation which will reverse the over regulation created by Dodd Frank AmericaFirst
1,I knew it Comey the Main Leaker What A WEAK Man Vindicated AmericaFirst MAGA ALL OBAMA HOLDOVERS FIRE
1,Missing World Trade Center MAGA TrumpTrain AmericaFirst SocialismSucks BigGovSucks BlackLivesMatter
1,U DON T LIKE THIS muslimsimagines GET THE FUCK OUT OF MY COUNTRY AMERICAFIRST MAGA MYPRESIDENT
1,Thank you for being straight to point with Comey standing up for I ll remember next time you run AmericaFirst
1,Justice Go get the dirty rotten cop Comey TrumpTrain DrainTheSwamp DeepState
1,So funny So true AmericaFirst
1,THINK ABOUT THAT tcot ccot AmericaFirst
1,It would be great if you can take all of your friends and family and go live over there AmericaFirst
1,Justice Go get the dirty rotten Comey TrumpTrain DrainTheSwamp DeepState MAGA AmericaFirst
1,NOW LADIES YOU R ROCKING THE WORLD AmericaFIRST
1,Actually this is interesting and it s on CNN Hmmm AmericaFirst
1,Appears the decline of England is inevitable Avoid America GE2017 Brexit MAGA TrumpTrain
1,1995 BillClinton 2017 Trump 1995 State of Union thanks MAGA AmericaFirst America
1,Egypt receives almost 2 billion in foreign aid annually Meanwhile our streets are overflowing with homeless veterans Americafirst
1,Forgive my grammatical errors AmericaFirst MAGA TRUMP
1,THAT S RIGHT WE RE READY FOR HER LOCKHERUP MAGA TRUMPTRAIN AMERICAFIRST DRAINTHESWAMP HRC
1,Terrorist attack My guess is BLM George Soros or Radical islamic nutjobs again trump maga americafirst
1,Another idiot who does not know their history Democrats are tge party of KKK segregation a
1,An apolitical man is a Ken doll who thinks he s GI Joe AmericaFirst AllLivesMatter MakeAmericaGreatAgain
1,Remember the Civil War So choose your paths wisely This Veteran will stand with our POTUS
1,AmericaFirst means U S dentists should conduct restorations for AMERICAN patients Migrant patients tell more lies than Ted Cruz MAGA
1,Liberals continue this bs Trump Russia story When will you learn that you isolated yourself for middle America AmericaFirst MAGA
1,The Best Prize That Life Has To Offer Is A Chance To Work Hard At Work Worth Doing President Teddy Roosevelt
1,Hey GOP STFU about winning the election even if HRC won we would still need to deal with the RUSSIAN INTERFERENCE AmericaFIRST right
1,The drain is clogged with Comey DrainTheSwamp MAGA SethRich
1,Laughing and cheering too AmericaFirst Comey is a wimp BetaMale
1,DAILY DOSE OF TRUTH tcot ccot AmericaFirst MAGA MASA
1,Terrorist Hit and run driver of 2 cops is taken into custody Maybe BLM trump maga americafirst
1,Lower taxes for all maga americafirst trump gop deregulation lowertaxes taxes
1,Hahaha the FakeNewsMedia gossip channels don t get it MAGA
1,Way to go President Trump maga americafirst trump republican gop
1,is sitting back tonight enjoying a cup of Confefe Shiting Comey turds to BuildTheWall to keep AmericaSafe AmericaFirst MAGA
1,Exciting times Dems have imploded exploded and gone down in flames AmericaFirst PatriotsForAmerica
1,treason obstruction MAGA americafirst get facts to back up your claims
1,Got it DEAD WRONG Enjoy reading the New York Times News Americafirst Comey FakeNews MAGA TrumpTrain TrumpTrain
1,Who s the puppet MAGA comeyhearing ComeyDay MYPRESIDENT Americafirst
1,CCOT Major National Socialist Website Now Openly Promotes White Sharia TeaParty MAGA AmericaFirst AltRight
1,The crime is maga They don t want to see americafirst policies implemented
1,It is going to be interesting when justice catches up to Hillary and ALL of her treasonous minions AmericaFirst
1,BREAKING Lawmakers Demand Details on Crooked Hillary s Security Clearance tcot ccot MASA MAGA AmericaFirst MASA Trump TrumpTrain
1,It would be unAmerican to expect anything less than loyalty AmericaFirst
1,AmericaFirst Debates2016 Thank you New York he wouldn t get 10 of the amazing law enforcement officers
1,couter Ft B Wheel Pump It Trump Breakingnews Mix AmericaFirst edmfamily housemusic Inauguration
1,End the witch hunt Mueller is same as Comey MAGA DrainTheSwamp AmericaFirst
1,The TrumpTrain will rise up to save AmericaFirst like country hasnt seen since Vietnam should
1,No one got free drinks either cause PresidentTrump never sent out a tweet MAGA AmericaFirst
1,You too We will under your watch MAGA AmericaFirst
1,We had the Moslem brotherhood for 8yrs Iran collusion And we re not about the FakeNews
1,NOW WE ARE TALKING Keep Tweeting ignore the FakeNews and their ridiculous
1,Trump fights ISIS by having SA sic ISIS on nation that fights ISIS Yeah that makes a LOT of sense not MAGA
1,Thank u 4 the interview all u do 4 us Stand tall MAGA thnx 4 the loyalty to the American ppl AmericaFirst
1,Sean appreciate your work Let s focus on how to keep the Trump agenda moving forward pushing for
1,LOCKHERUP both LorettaLynch CrookedHillary ComeyHearing Comey MAGA HeIsMyPresident AmericaFirst
1,YES Let s get that wall built start moving the football down the field on
1,2016 MAKE AMERICA GREAT AGAIN AmericaFirst Trump2016
1,Thank you our President for always fighting for AmericaFirst
1,Oh heck him too Covfefe AmericaFirst Winning BigLeague DrainTheSwamp EvilLosers MAGA
1,Sad but true This nation needs morality honesty personal responsibility and to eliminate the sense of entitlemen
1,That sums it up Covfefe AmericaFirst Winning BigLeague DrainTheSwamp EvilLosers MAGA
1,Me either A witch hunt just like he said A waste of time and money on all o
1,Happy 11th Birthday Barron Trump America you MAGA TrumpTrain AmericaFirst ObamaGate TCOT MCGA Cdnpoli Brexit Wiretap
1,There taking us back to the systems that caused the economy to crash HOW DOES THIS MAGA HOW DOES THIS PUT
1,Can you Run this By Alex A New Crowdfunding Facebook hybrid to help fund turn AmericaFirst Ideas Startups into a reality
1,It s a Swamp Covfefe AmericaFirst Winning BigLeague DrainTheSwamp EvilLosers MAGA
1,And Clinton Covfefe AmericaFirst Winning BigLeague DrainTheSwamp EvilLosers MAGA
1,comey you just made TheLIST WeThePeople have had enough of this Russia BS MAGA ComeyDay ComeyHearings
1,you look angry Don t be a hater Everything will be ok Breath relax LeeEricNewton TrumpIsOurPresident AmericaFirst
1,Absolutely Talk about Rigged Covfefe AmericaFirst Winning BigLeague DrainTheSwamp EvilLosers MAGA
1,Who knew DrainTheSwamp meant the previous Administration and Comey Covfefe AmericaFirst Winning BigLeague
1,We support you 1 000 000 000 percent Comey had better hire a lawyer LET DONALD GOVERN in peace AmericaFirst MAGA
1,The more they try to dig up dirt on Trump the more we keep finding evidence against the Clintons the Democrats LOL AmericaFirst MAGA
1,Just 1321 days 13 hours 10 minutes 37 seconds left in office AmericaFirst
1,ill take the center square for the winning MAGA AmericaFirst
1,Monica Crowley on summed it up that Comey Confirmed He s NOT a Boy Scout Spot on ComeyDay MAGA AmericaFirst
1,We are going to negotiate a FAIR DEAL for Americans AmericaFirst
1,Trending now IWontGiveUpBecause I Never Give Up MAGA AmericaFirst every time going forward We all win when we win UNITED POTUS
1,not breaking things he s breaking people Two in one week AmericaFirst
1,GO AWAY YESTERDAY JUST GO AWAY PURSUEPOTUSAGENDATODAY AmericaFirst DOYOURJOBCONGRESS
1,THANK YOU FOR FINALLY STANDING W POTUS AmericaFirst STANDWITHTRUMP GETYOURJOBDONECONGRESS PURSUEPOTUSAGENDATODAY MAGA
1,AMAZING how you move forward daily in the solution to MAGA despite all the hatred from Dem leftist scumbags AmericaFirst
1,If there must be trouble let it be in my day that my child may have peace Let s get this done NOW friends
1,Despite all the accusations lies distractions and you continue to fight for our country THANK YOU AmericaFirst
1,A Man has his word and finally we have a who stands by his word to MAGA and put AmericaFirst
1,Father of Reality winner response sounds like engineered persuasion is d3 3p state coaching these people trump
1,That TRUMPTRAIN keeps rolling Love our MAGA AMERICAFIRST
1,Europe couldn t afford socialism if the US wasn t providing their global security AmericaFirst MAGA UKElection2017
1,The Left is Imploding They are Bankrupt Buh Bye MAGA AmericaFirst TrumpTrain
1,We are WINNING and WINNING BIG Thank You President AmericaFirst
1,President Trump Hosts Infrastructure Summit with Governors and Mayors today MAGA AmericaFirst
1,Here is a cheat sheet for libtsrds MAGA AmericaFirst ComeyTestimony ComeyDay comeyHearings ComeyTheLeaker
1,There is new hope for America and gives air time to wake them up MAGA AmericaFirst Trump TrumpTrain POTUS resist
1,I say we save this spot on Mt Rushmore for Winning AmericaFirst HesWithUs
1,You re either AmericaFirst or you are my enemy AMERICAFirst Unless you re a Brit then you should be BritainFirst
1,Trump2016 AmericaFirst Thank you Michigan This is a joke
1,BarackObama legacy USA divided more liberals progressive hates thugs and crimes
1,Watching these people get it so wrong never gets old hahaha maga trumppence americafirst
1,The come leaker MAGA AmericaFirst ComeyTestimony ComeyDay comeyHearings ComeyTheLeaker ComeyHearing
1,Smart No tweeting forced EVERYONE to watch today s hearing to see what you have been saying all along MAGA AmericaFirst
1,The FBI know CAIRNatiinal is a terrorist organization funded by Hamas AmericaFirst BREAKING
1,extinction Deserved the Democrats have done NOTHING for America TRUMP WINNING AMERICA WINNING AmericaFirst
1,You were classy and to the point Don NOW LET S END THE WITCH HUNT Today was
1,Appears that the Trump Russia collusion was a bunch of nothing even members of the left are done with this story AmericaFirst surprise
1,keep them on their heels sir AmericaFirst
1,CNN SUCKS FakeNews FakeNewsCNN tcot ccot MAGA AmericaFirst
1,AmericaFirst head of the FBI Comey pathetic PresidentTrump doing an ama
1,Me thinking about AlGreen BradSherman drafting impeachment papers after today s ComeyTestimony MAGA
1,THIS tcot ccot MAGA MASA AmericaFirst
1,3 billion dollars to so called Green Climate Fund increase international aid And LOSE for the American people No more AmericaFirst
1,You misspelled vindictive MAGA AmericaFirst treasonweasel TrumpCrimeFamily Trumprussia TrumpCare
1,Oh to be a fly on the wall at the closed congressional hearing ComeyTestimony MAGA DTS AmericaFirst
1,I agree Do You AmericaFirst MAGA
1,THANK U FOR NOT LEADING US AS SHEEP TO SLAUGHTER AmericaFirst MASA MAGA tcot ccot
1,Gee whiz Phil Why not let dear sweet Loretta tell you what to do WHAT A TOOL MAGA AmericaFirst ComeyLeaks
1,A party will be hosted live at at 10pm at Fox News trump maga americafirst
1,Well Someone s heart has been broken and can t be fixed MAGA AmericaFirst Trumptrain DrainTheSwamp HeBrokeMe
1,thanks for the RT AmericaFirst TrumpsAmerica
1,IWontGiveUpBecause the only way to make America great again is to let me fuck it all up to begin with AmericaFirst MAGA TheResistance
1,You are a guest in my country and if you hate our so much maybe you should leave America and
1,CCOT It is during times like these that we must remember MAGA AmericaFirst TeaParty Christians
1,You re still a punk and by the way you re NOT President anymore thank God MAGA AmericaFirst
1,Cernovich on Periscope ComeyDay cucks the fake news media MAGA AmericaFirst
1,you were in a business mtg with You weren t out on a date Dumbass Trump MAGA
1,Did the National Left Wing Media ever Demand She Apologize Why Not MAGA TrumpTrain AmericaFirst WDShow
1,Thank you so much I appreciate that AmericaFirst
1,u dont HAVE to LIE BC lib flakes dont condemn terrorist attacks EITHER Resist LibFlakes AmericaFirst
1,definitely feeling what is singing out AmericaFirst TrumpTrain
1,DCDEFLATEGATE We found 1 of the Leaks Comey ComeyHearings AmericaFirst Trumptrain ComeyDay FBIDirector
1,ur delusion is showing clearly ur not following this correctly AmericaFirst MAGA
1,Trump 156 IQ AmericaFirst Now let s do it again 2020
1,The winning continues AmericaFirst DraintheSwamp MAGA Hannity
1,TrumpTrain DrainTheSwamp MAGA AmericaFirst IStandWithHannity Disgusting
1,Was for us Cuck MAGA AmericaFirst
1,GE2017 Who cares AmericaFirst Good luck ridding yourselves of the swamp in your country
1,has no great love 4 but he has his back like he should unlike loser Rinos like AmericaFirst
1,No more We re going to renegotiate A FAIR DEAL AmericaFirst
1,What we learned from Comey s testimony MAGA Winning TrumpTrain TrumpsArmy AmericaFirst TrumpsArmy2
1,an international embarrassment maga americafirst TrumpTrain tcot deplorables resist
1,You re the biggest side show freak Congress has ever seen Trump2020 MAGA AmericaFirst
1,WallStreet s Wet Dream Be able to gamble the American people s like before Great Recession GOP Fooled again
1,Mwahhahahaha we gotcha scared now Don t grimace man up and present your case against
1,And I make money every time it gets used And I m my own landlord So I lower my rent It s a win win
1,CCOT Join MarchAgainstSharia June 10th 2017 FoxNews radicalislam AmericaFirst law MAGA TeaParty Info ACTforAmerica
1,MAGA AmericaFirst ComeyTestimony ComeyDay comeyHearings ComeyTheLeaker ComeyHearing thanks for p
1,MAGA TrumpSupporters TrumpTrain don t be blind and deaf to the reality that Russia is not our friend Trump s no
1,Some people are JUST PLAIN DUMB She fits the category Maybe her cell mate will make her pay for her crime MAGA AmericaFirst
1,giving the play by play on Comeys fail Day MAGA AmericaFirst winning
1,American s know that this wasn t going to be easy This endeavor you took Jobs Family AmericaFirst Trumptrain
1,Comey is nothing but a leaking liar AmericaFirst ComeyFiring ComeyLied DrainTheSwamp
1,We have outspent every other nation since WWII Where s everyone else No more AmericaFirst
1,Well said MAGA AmericaFirst
1,Dear can you plz put AmericaFirst take action against Russia hacking our elections Its a HUGE cloud hanging over US
1,Glad you re OK Why do you think he d know such a thing Give the new kid on the b
1,Thank You President Trump We the people support you PresidentTrump MAGA AmericaFirst in4words
1,Humorous Hillary excuses viral americafirst
1,Same crime shouldn t they have matching orange outfits JamesComey DTS MAGA
1,Liberals hope to impeach President Trump unfortunately hope is all they have Comeyday AmericaFirst DTS
1,We are here to negotiate a solid economic deal FOR AMERICANS This is first and foremost about America winning again AmericaFirst
1,Comey s WORLD AmericaFirst BigLeagueTruth BlueLivesMatter TUCKER HANNITY DOBBS ComeyTestimony
1,Wow How hypocritical maga trumptrain potus americafirst potus
1,al Green is a racist Liberal who would like nothing better than to destroy President Trump
1,Yup business as usual in the americafirst agenda to MAGA Thank you for all yo
1,America is a world leader in health inequality The Washington Post AmericaFirst
1,Let s get back to work God bless you and your family maga trumptrain 45 potus americafirst comeyday
1,This issue will not go away I bet Comey is kicking himself right now MAGA PresidentTrump Americafirst
1,The thinks they can rob OUR universities of qualified scientists WRONG We re going to keep AmericaFirst MAGA
1,How is rolling us back to the same systems that lead to the market crash a GOOD THING MAGA AmericaFirst
1,Obama Abe IslamicState AmericaFirst JapanFirst Islamabad
1,Not for naught Resistance was killed agenda for 6 months He must hurry up now refugees immigration jobs AmericaFirst
1,Licensesgate Cheese suspected of immoral cheating with the KeystoneXL americafirst
1,Where s you evidence Post it AmericaFirst MAGA
1,No DEMS hate America Apologetic for being progressive wanting 2B the best country in the world
1,Oh Corey It already has AmericaFirst CNNFakeNews COMEY
1,The Majority of American are supporting trump Huge AmericaFirst The leftwing liberals would rather obst
1,McCain defends the Washington Post far more than he defends POTUS Where are your loyalties
1,We have the ball we need to Slam Dunk It AmericaFirst MAGA
1,Great Britain inches closer and closer to a bloody civil war real violence This is not good trump maga
1,realDonaldTrump Supporting you to the hilt Trump MAGA AmericaFirst ComeyHearings StrengthInNumbers ChargeOn
1,Comey is two faced AmericaFirst POTUS45 DOBBS HANNITY GOWDY
1,Exactly MAGA AmericaFirst Covfefe4Rights
1,These 2 traitors need to be made an example of a publicly televised hanging or a military firing squad will make it
1,Well I would need to read it first MAGA AmericaFirst DTS
1,YEEEEEESSSSSS MR VICE PRESIDENT Nice AmericaFirst MAGA Comey ComeyHearing TRUMP
1,C mon Republican partiers what happened to AmericaFirst https t co ZRy24NJ62K
1,is creepy need to check for child porn MAGA AmericaFirst ComeyDay comeyHearings PedoGate
1,MAGA AmericaFirst ComeyTestimony ComeyDay comeyHearings ComeyTheLeaker if u think he leaked after twee
1,Always AmericaFirst
1,What do expect people They hate everyone and have no problem letting the world know it WAKEUPAMERICA a
1,CCOT Thank the Alt Left for this great tip MAGA AmericaFirst TeaParty tcot tlot conservatives GOP
1,Do not say a thing about the dresses on FOX we love the foxes on FOX Smart and beautiful AmericaFirst MAGA
1,Thankful for such a wonderful no BS MAGA AmericaFirst Trump
1,I didn t tune in The show was probably mediocre at best MAGA AmericaFirst Trump2020
1,Happy 11th Birthday Barron Trump America you MAGA TrumpTrain AmericaFirst WDShow
1,Never get tired of hearing read The Snake Poem Perfect example of what has happened in Europe MAGA
1,Comey Exonerates Trump So Much For Obstruction Trump2016 MAGA AmericaFirst BuildTheWall YUGE
1,Once again they are showing their lack of intelligence AmericaFirst Vindication MAGA
1,MAGA AmericaFirst Trump DTS libtard snowflake deplorables What s the plus for going back to the system tha
1,In ChinaInTheWorld podcast says that Trump s AmericaFirst policy might not be as narrow as we thought
1,The best reasons I ve heard so far for ComeyFiring ComeyDay ComeyHearings Comey MAGA AmericaFirst
1,My daughter doesn t play fair MAGA AmericaFirst
1,Would You Vote for a Barack Obama AmericaFirst MAGA TrumpTrain  __ _
1,Priorities of an AmericaFirst GOP
1,If you live in Cascadia and uphold the 14Words follow 4 follow Let s build a White community Oregon
1,MAGA This is WHY we voted Republican in on 1 explosive issue MakeAmericaSafeAgain MASA AmericaFirst MAGA MaraLago
1,Someone tell what a REAL big nothing burger looks like following Comey s testimony comey Americafirst ArrestComey
1,and the house of Republicans are killing Americans they re failing to do one job and put AmericaFirst AmericaDeservesBetter
1,AmericaFirst suck it Comey YourFired the haters Keepwinning
1,Way more evidence for RussiaGate than for Benghazi so why don t you put AmericaFirst and wait fo
1,ComeyHearing Top 10 Facts MAGA AmericaFirst Patriot RussiaGateIsFake ClintonEmails
1,making excuses for is not okay DoYourJob AmericaFirst ComeyDay ComeyHearing
1,MAGA AmericaFirst ComeyTestimony ComeyDay comeyHearings ComeyTheLeaker ComeyHearing
1,Yo note to everyone the trolls are out in force tonight so be on your Guard ComeyDay covfefe MAGA AmericaFirst
1,Happy 11th Birthday Barron Trump America you MAGA TrumpTrain AmericaFirst Dobbs MAGA Trump Islam WomensRights
1,Rights are not Gifts from Government politicalcorrupton AmericaFirst
1,No we don t AmericaFirst BuildThatWall
1,TIMELY TWEET AmericaFirst
1,Just think what GlobalWarming money could be used for NYC AmericaFirst MAGA
1,Illegal aliens account for more US military funding AmericaFirst USA MAGA
1,americafirst Librariesgate The Rand Paul caught immoral affair of the heart on the executive order thankyoutrump
1,Why the UK election matters to the US CNBC AmericaFirst
1,MAGA Thank you for not acknowledging Comeyand the dog and pony show AmericaFirst
1,MAGA AmericaFirst Patriot Trump Truth is the highest thing that man can keep Geoffrey Chaucer truth will always win over lies
1,comey lying and killed trump russia bullshit Damn fine day MAGA AmericaFirst ComeyTestimony ComeyDay
1,Winners NEVER Stop winning MAGA AmericaFirst Trump
1,I REALLY LIKE THIS FLAG IF YOU DON T PLEASE FEEL FREE TO TRY ANOTHER ONE BUT NOT HERE AmericaFirst
1,Help spread the word AmericaFirst
1,Not a chance I have no use for Fake News Slanted stories as you ve historically done Sell it to the DemRats you
1,I believe Our has had a clear plan on how to DrainTheSwamp and has been implement
1,House approves legislation which will reverse the over regulation created by Dodd Frank This is good AmericaFirst
1,MAGA AmericaFirst TrumpTrain Deplorable Conservative Patriots Show Your Pride everywhere you go
1,TuckerCarlson Two Dems on the show You got bulldozed tonight Trying to look bad SMH maga fakenews trump AmericaFirst
1,Once we DumpTheDems by playing tape of their own hateful behavior everything
1,Liberals get it through your small minds These are the facts HesMyPresident IStandWithPOTUS AmericaFirst
1,You ve seen him right AmericaFirst lockUpLynch COMEY
1,No brainer girlswithguns 2NDAMENDMENT defend2nd girlswithbackbone AmericaFirst MAGA
1,Exactly Cares about the American people period POTUS MAGA AmericaFirst TrumpTrain
1,AmericaFirst or Israel first
1,Elizabeth Warren college days MAGA TrumpTrain AmericaFirst SocialismSucks BigGovSucks BlackLivesMatter
1,Lordy ty for DrainTheSwamp President Trump AmericaFirst NotAPolitician Thank you Jesus Ty Jesus protec
1,Would TheresaMay have fared better or worse if London not Riyadh was FirstStop of AmericaFirst cheerleader of Brexit UKElection2017
1,Just when I think there are no more variations there is always HOPE AmericaFirst MAGA TrumpTrain
1,bring back MAGA AmericaFirst TrumpTrain CNN liberals racism RACISM
1,On behalf of every Deplorable in the US and around the world THANK YOU for all you are doing and will do to
1,FDR says Let s Make This Show Great We ve got common sense Let s show it deplorables
1,Chris Farrell of Judicial Watch on Lou Dobbs Many in FBI think Comey is a Dirty Cop TrumpsATeam TrumpsArmy2
1,Just 1321 days 16 hours 10 minutes 37 seconds left in office AmericaFirst
1,Some things in life should never be for profit Healthcare Prison Air traffic controllers AmericaFirst HumanityLast
1,Let s get SUSANRICE trending She ordered the unmasking Time to lock her up MAGA OneNationUnderGOD AmericaFirst MAGA
1,We ll bankrupt them by the time we find out the answer to that question You re the real news now trump maga
1,No vacation for Congress It s time to get the work done Stop the slow role AmericaFirst ComeyHearings
1,President Thank You for putting AmericaFirst LouDobbs MAGA
1,we are behind you sir maga americafirst greatnation
1,INVESTIGATION then Charges Now AmericaFirst
1,Investigation smeshtigation let s just call it a matter Let s bury this Matter let the President get to work 45 AmericaFirst
1,Thank You AmericaFirst
1,In Rem actions have been used since the time of pirates to seize proceeds of criminality
1,Many AMERICANS believe but again he lied and said opposite AmericaFirst
1,Like we didn t already know THAT ComeyDay MAGA AmericaFirst DrainTheSwamp DrainTheDeepState
1,So glad fired unmasked and truth he was a leaked He was a Traitor while at FBI AmericaFirst
1,realDonaldTrump We will not let other countries take advantage of the United States anymore We are bringing back OUR jobs AmericaFirst
1,MAGA AmericaFirst Patriot Trump ComeyHearing says Lynch influenced him re Clinton no that s not political
1,Classic maga americafirst comeyisliar cnnsucks trump
1,Irony 43 presidents put AmericaFirst Putinspuppet is first to ever put 1 Self 2 Kids bank accounts 3 Russia USA ranks distant 4th
1,We will not let other countries take advantage of the United States anymore We are bringing back
1,I ll say this about Trump he s been such a monster buffoon I ve stopped caring internationally focused on the horrors in AmericaFirst
1,Totally agree AmericaFirst
1,He should ve been put in handcuffs and escorted out ComeyTestimony ProTrump MAGA DTS AmericaFirst
1,Bakken AmericaFirst MAGA ccot tcot Some frack opposition folks should study data for clarity sake
1,Lol Wake up He did AmericaFirst
1,Exactly AmericaFirst
1,Of course he can He could tell FBI to stop President is the boss He could also issue a pardon Thank y
