0,YOU are the leaker You leaked classified information from an ally to the Russians You re a LOSE
0,nothing but a LiarInChief ComeyIsAPatriot not a leaker you need to resign take your clan
0,Potus is nothing but a LiarInChief he must RESIGN besides ComeyIsAPatriot passed on info after he tweeted he had
0,Your denial of the dangerous problems w this admin is frankly insulting to the American peo
0,Testify under oath then Also notice still not a negative word about he danger of Russia from dt
0,You re a liar Comey was under oath When will you go under oath Nah you d rather tweet ComeyIsAPatriot
0,Vindicated Sounded more like a neatly wrapped package with a bow for obstruction of justice
0,Are you leaking in your pants yet ComeyIsAPatriot and certainly no leaker
0,Comet was protecting himself ComeyIsAPatriot
0,Wrong You re the puppet Comeyisapatriot trumprussia
0,You are a liar and can t be trusted ComeyIsAPatriot
0,ComeyIsAPatriot and he leaked unclassified information to help the country Not like you who leak
0,haha nothing but a LiarInChief you must RESIGN besides ComeyIsAPatriot passed on info after y
0,Finally he speaks ComeyIsAPatriot Where are the tapes ShowUsTheTapes
0,Trump understood the law when it came to the Clinton Lynch meeting ComeyIsAPatriot TrumpRussia Resistance
0,Comey testimony fortifies Trump obstruction case ComeyTestimony ComeyIsAPatriot Run for Office Mr Comey
0,karma really is a bitch isn t it ComeyTestimony ComeyIsAPatriot TrumpRussiaCoverUp
0,ComeyIsAPatriot spoke the truth u the LIAR in chief UNDER ABOUT YOU UNDER OATH IMPEACH
0,James Comey is a PATRIOT Period End of line ComeyIsAPatriot
0,Fuck you DTJr That moron can t do a damn thing for our country and either can his
0,There s more folks there than at 45 s inauguration Resistance ComeyIsAPatriot LordyIHopeThereAreTapes
0,HERE I fixed Sarah s mistake trumpRussia trumpIsALiar ComeyIsMyHomey
0,We re going to enjoy our bee
0,Cheer up this just the beginning of trumprussia for his satellites hmm satellites do
0,Hey Hand Job Billy yes please spin your fake news TrumpRussiaInvestigation TrumpRussiaCollusion
0,Not even a close choice AbuseOfPower ComeyIsAPatriot NotMyPresident
0,Succinct and as the Brits would say brilliant twt with that I am out for comeyisapatriot day
0,Because that s his M O before he gets all rapey starts grabbing pussies only this pussy had BALLS Comeyisapatriot
0,Of course because is corrupt What don t you get about this he is a Rus
0,So do we sir so do we ComeyDay ComeyIsAPatriot
0,no investigation for unclassified info prez spreads all over tv amp twitter hanky ComeyIsAPatriot
0,What Eric Trump didn t want the job TrumpCrimeFamily ComeyIsAPatriot Impeach45
0,You re just the person to add some levity to this political sh tshow Get one of these
0,From one self righteous prig to another kindred spirits must be why Trump kept calling him to come ove
0,Brilliant ComeyIsAPatriot
0,Was the information classified or secret as a matter of a federal law Absolutely not ComeyIsAPatriot
0,I m pretty sure you meant whistleblower ComeyIsAPatriot
0,James Comey is a private citizen and these are his own personal notes SeeTrumpTweets SeeTrump sMSMI
0,Did Rubio trade the integrity of U S for a Cuba policy shift from Trump MAGA TrumpRussia ComeyIsAPatriot
0,The difference is remarkable Today ComeyIsAPatriot CountryOverPresident Yesterday ObstructionOfJustice
0,Not offended Baffled by trumpsters igno
0,Sorry your wrong its just the beginning ComeyHearing ComeyDay ComeyIsAPatriot
0,the nation truly wants to believe this ComeyIsAPatriot ImpeachTrump
0,TheResistance wants team treason to go under oath like ComeyIsAPatriot Sadly liars won t
0,ComeyDay is the day America celebrates a fat orange troll getting punched in the face by a giant dick Still ComeyIsAPatriot
0,Time to ImpeachTrump LockHimUp and throw away the key ComeyDay ComeyTestimony ComeyIsAPatriot
0,Lordy Mr James Brien Comey sane Americans are grateful for your testimony today AmericanHero ComeyIsAPatriot theresistance
0,Trump silent today He knows his goose is cooked TrumpObstructed TrumpRussia ImpeachTrump ComeyIsAPatriot
0,Oh Yes They Do PENDEJO ResignAlready TrumpCriminal ComeyIsAPatriot TrumpLeaks TheResistance
0,Trump ran straight to the Evangelicals to have his tiny hands held I m sure he ll er
0,Uh guess this is important to remember if is under oath ComeyIsAPatriot
0,LOL Is too dumb to realize that this tweet is saying that his father WAS putting pressure
0,This is not to be missed comeyismyhomie ComeyIsAPatriot ComeyHearing ComeyHearings
0,Uh Oh Comey is more famous than POTUS always a bad thing ComeyIsAPatriot
0,Take it from the Republican faithful Trump s not a liar just an idiot Ummm ok Trumprussia ComeyIsAPatriot
0,He s the bigliest liar ever Believe me trumprussia TrumpLeaks ComeyTestimony ComeyIsAPatriot LordyIHopeThereAreTapes
0,ComeyIsAPatriot America witnessed a true American hero in action He is doing his best to protect our democracy
0,Me too Just listened to Comey s testimony grace integrity and intelligence H
0,THIS trump IS JUST ANOTHER PIECE OF S T JUST LIKE DADDY ComeyIsAPatriot FollowTheFacts
0,Do you have ANY IDEA how ridiculous that sounds Really Do you Serious question comeyhearing
0,has lost all credibility by not having a backbone to stand up to the lying new
0,the fact you are ignoring shirking your responsibility will cost you in 2018 TrumpObstructed ComeyIsaPatriot
0,This is written in my language ComeyIsAPatriot ComeyDay TheResistance
0,EichenwaldAMovie The Treason is coming from inside the house ComeyDay ComeyIsAPatriot Trumprussia
0,You were never a Democrat just always an idiot TeamKurt ComeyIsAPatriot
0,Patriotism means your loyalty is to America It requires courage to tell the truth no matter how difficult or mess
0,ComeyIsAPatriot BlueWave ThankYouComey We appreciate you DEMOCRACY AT WORK
0,There s NO excuse ObstructionOfJustice loyaltypledge ComeyTestimony trumprussia ComeyIsAPatriot
0,Sue All Those Russian Traitors For Defamation ComeyIsAPatriot
0,ComeyIsAPatriot comey goes nuclear in showdown with russianspyagentorange45
0,I learned that doesn t have one member who is loyal to the country Only to the party And Trump is a lyin
0,CoreyLewandowski another TrumpLiar ComeyIsAPatriot TheResistance keep your focus ACHA can not pass
0,I don t believe anything PaulRyan says Trumplies ComeyIsAPatriot
0,Hillary Hillary Hillary You Reps sure are obsessed with her
0,Golly that s a real head scratcher HOWEVER WILL WE FIND THE TRUTH ComeyDay ComeyIsAPatriot TrumpRussia
0,This moment had me cheering and tearing up ComeyIsAPatriot
0,Swearing on a bible means nothing to a lying fake Christian ImpeachTrump ComeyIsAPatriot LiarInChief
0,Great thread TheResistance FBR TrumpLies ComeyisaPatriot ComeyDay
0,tyvm4RT Resist TrumpCare WhatIfObamaDidThis TrumpRussia UniteBlue ComeyIsAPatriot
0,Interesting to see how both sides of the aisle are spinning ComeyDay My take away ComeyIsAPatriot
0,ComeyIsAPatriot anyone who says differently believes in leprechauns
0,Trump is a criminal and a liar ComeyIsAPatriot TrumpRussia
0,Comeyisapatriot and you are a corrupt liar ImpeachTrump
0,you wanna call Comey a liar You go under oath tell us YOUR version of the truth Bet you can t ComeyIsAPatriot
0,Let s be clear It s NOT Comey Not fooled by the WhiteHouseMobsters ImpeachTrump
0,SteeleDossier will now be relevant ComeyIsAPatriot Stone Rogers Coats cowards
0,Uday and Qusay Trump corruptfamily trumplies ComeyIsAPatriot comeytestimoneywasthetruth outoftouchelites trumpsalwaysfailing
0,Impeach Trump Now ComeyIsAPatriot ComeyIsAPatriot ComeyIsAPatriot TrumpObstructed TrumpObstructed
0,Ah It better be before the end of the month ComeyIsAPatriot Impeach45
0,Yes and Comey did know exactly what he meant ComeyIsAPatriot
0,Wow signed 36 bills how many passed Oh Spicey sad TrumpRussiaInvestigation
0,I think should go back to fox Her devils advocate stance is a bit grating I m just saying ComeyIsAPatriot impeachtrump
0,comeyisapatriot Not a difficult question who to believe Comey or habitual and proven liar Trump Comey is a patriot trumprussia
0,So you re happy living on the Island of Misfit Toys AlternativeFacts ComeyIsAPatriot lordyihopetherearetapes
0,Americans don t trust the GOP either Stand up to Trump and do your damn jobs YOU all work for the American people ComeyIsAPatriot
0,Very good point I kept wanting Comey to say Because he s the POTUS i e Not my place
0,career as FBI Director cut so soon with 6 years left The honesty he showed today is som
0,We remain that shining city on a hill and they don t like it comey Chills ComeyIsAPatriot
0,ComeyIsaPatriot who wants to tell the truth
0,Comey is 10 steps ahead of Trump comeyismyhomie ComeyIsAPatriot
0,I watching ComeyIsAPatriot expose your wannabe mob boss ego Your nickname Tiny Hands in the C league mob world
0,Patiently waiting for the tapes CrookedTrump ComeyDay ComeyisaPatriot TrumpRussia
0,American has always been great or did you forget ComeyIsAPatriot TrumpTreason
0,Another good think about Comeyhearing TrumpBots R on attack I can block them all ComeyIsAPatriot TrumpisDone impeachment
0,let me see if I received your message crystal clear gets a pass because he s an idio
0,Nope Never ComeyIsAPatriot ComeyDay AboveTheLawSyndrome impeach45
0,All you do is prove money can t buy brains TrumpsAreScum TrumpIsATraitor ComeyIsAPatriot ImpeachTrumpNow Resist
0,Agreed Not a leak if he s now a private citizen his own personal notes not confidential
0,ComeyIsAPatriot His children will be so proud of their father
0,Yeah not going to happen No one will take 45 s word over Comey s ComeyIsAPatriot
0,let me Ponder on this for a moment The liar is trump yes yes Comeyisapatriot impeachtrump TrumpRussia
0,You re all corrupt ComeyIsAPatriot TrumpRussia GOPTrumpRussiaComplicit
0,Highlights From Comey s Testimony ComeyTestimony ComeyIsAPatriot trump is a liar and fraud
0,Trump uses personal criminal attorney to claim Comey committed a felony ComeyIsAPatriot Trumpisaliar
0,you should pay attention to this quote ComeyIsAPatriot CountryOverParty TrumpRussiaInvestigation
0,Why Russia Matters Video ComeyIsAPatriot SenateIntelHearing TrumpRussia KremlinGate
0,Liars of a feather if you will TeamComey Comeyisapatriot
0,Also he shared info with FBI DOJ Get them to testify also Comeyisapatriot Trumprussia Obstruction
0,Senate should subpoena ALL who comey shared info with Than it will be 10 to 1 comeyisaPatriot trumprussia
0,EXACTLY ComeyDay ComeyIsAPatriot
0,Don the con is the only leaker To the Russians COMEYISAPATRIOT
0,wow just wow Comeyisapatriot
0,comeyisapatriot comeyforpresident impeachtrump comey honest trumplies
0,All of them RyanIsATraitor ImpeachTrump ComeyIsAPatriot TrumpRussia GOPCowards TrumpIsALiar VoteGOPOut re
0,Oh yeah I forgot Comeyisapatriot
0,ComeyIsAPatriot TrumpRussia will NEVER go away
0,Precisely but he was smart enough to know THERE IS INE w Trump hence the notes comeyIsAPatriot
0,Bye bye little Rubio you are no patriot You sold your soul to TrumpRussia must go TheResistance
0,Greatness ComeyDay ComeyTestimony JamesComey Comey ComeyHearings ComeyIsAPatriot
0,But if she used a private email server they d prosecute her to the max GOPareTraitors ComeyIsAPatriot TrumoIsATraitor
0,Oh Donnie Jr the stench of your desperation is almost as bad as your tiny hand daddy
0,You betcha countrybeforeparty CountryOverParty CountryOverPresident ComeyIsAPatriot ComeyDay
0,And he s right ComeyDay ComeyIsAPatriot TrumpIsATraitor ImpeachTrump
0,I learned all missed class the day they taught that you don t ask a Q if you don t know answer you ll get
0,My oh my I would like a president who knows what he s doing and is not dangerously ignorant Russian spy
0,You missed the fact that you re all traitors 45 obstructed justice because he s too stupid to know
0,No one makes the perfect choices 100 of the time But 99 is way better than anyone I know so I f
0,Release the tapes with proof comey is lying trump is a LIAR Russian spy this lawyer is bold face lying
0,Is this what you should be talking about today Seriously ComeyISAPatriot TrumpRussia
0,This is Very Bad ComeyIsAPatriot TrumpRussia GOPRussia
0,Trump Jr ought to learn a lesson from Daddy while he s still fairly young keep his mouth SHUT on twitter
0,To James Comey we appreciate you TheResistance appreciate you The world appreciate you ComeyIsAPatriot TrumpCrimeFamily RussiaGate
0,Trump lies TrumpRussia TrumpLies TheResistance ComeyIsAPatriot
0,Yep cannot rewrite these facts ObstructionOfJustice ComeyIsAPatriot
0,ComeyIsAPatriot Trump s private attorney lies for him as well ComeyTestimony under oath Hhmmm
0,Trump s lawyer should stop lying and I believe defamation is also a crime Comeyisapatriot
0,If u were mad about Lynch B Clinton meeting but are ok with Trump Comey mtgs you are putting party over country ComeyDay ComeyIsAPatriot
0,Oh lordy no He s a cross between James Bond Captain America He s also now a full fledged member
0,Listen to Daddy ComeyDay ComeyIsAPatriot
0,lordyihope ComeyDay Comeyisapatriot Comey cares about our country unlike Trump or the Republicans that are shielding him
0,IMPEACH THE LYING TRAITOR TO AMERICA THE AMERICAN PEOPLE ImpeachTrump MAGA Comey ComeyIsAPatriot TrumpRussia
0,TrumpLied YUGELY WeThePeople want JusticeForAll ImpeachTrumpNOW Happy ComeyDay Comey told the Truth
0,That s not an excuse This clown needs to be voted out as well ImpeachTrump ComeyIsAPatriot
0,Wrong Wrong Wrong 3 Strikes You re outta here ComeyIsAPatriot
0,Come now You can do better than that That was weak sad TrumpRussia Treason Traitor ComeyIsAPatriot TheResistance
0,Not sure what hearing McCain thought he was at ComeyIsAPatriot comeytestimoneywasthetruth
0,I am ashamed Country over party please TrumpRussia Comeyisapatriot
0,Exactly ImpeachTrump ComeyisAPatriot
0,Keep living in your money laundering bubble Jr Your Daddy is GUILTY America kno
0,STFU Pinocchio Jr You all will die in prison ComeyDay ComeyTestimony ComeyIsAPatriot
0,ComeyIsAPatriot we all heard the TRUTH not what your people try to spin
0,45 has because Liars and Traitors stick together when they attempt to defame Patriots ComeyIsAPatriot
0,You can t just hear what you want to hear You have to hear all of the damn facts THE TRUTH Trumpobstructed comeyday ComeyIsAPatriot
0,ComeyIsAPatriot unlike your father
0,Lies lies lies lies Everything you said Mr Trump is a lie plain and simple Even your lawyer just now lied ComeyIsAPatriot
0,I guess the tapes that Trump insinuated to exist were destroyed hmmmmmmmm ComeyIsAPatriot ComeyDay trumptanic
0,Yep Trump motto only illegal if you get caught even then their gilded cages keep them protected N
0,No we still hate your dad ComeyIsAPatriot ImpeachTrump
0,Let me clear up any confusion I am FIRMLY TeamComey I do believe that ComeyisaPatriot Trumprussia Impeach45
0,The Roadblock Republicans ComeyDay ComeyIsAPatriot
0,It s interesting how there are so many excuses made for the worst president in US history GOP history will be very
0,Yes Indeed TRUE PATRIOTS Portraits and Actions sallyyatesisapatriot PreetBharara ComeyIsAPatriot
0,Clearly this lunk heads have no idea what the FBI does It isn t their job to stop a crime it is to investigate cri
0,are you sure you heard the same testimony the rest of the world heard Trump colluded obstructed ComeyIsAPatriot
0,comeyday alerted all his bosses about TrumpRussia and his statements Factsmatter they can testify to TRUTHS
0,he s got lies on record Stop kidding yourself liarinchief resist TrumpObstructed ComeyIsAPatriot
0,you might want to let your Attorney know you waived executive privilege Oh by the way ComeyIsAPatriot has incriminated you
0,Yes Finally the truth will come out ComeyIsAPatriot ImpeachmentIsInevitable
0,Yeah he was sad but COMEY WAS AWESOME ComeyisAPatriot
0,Is it against the law for come to leak his own personal unclassified memos Comeyday TrumpRussia Obstruction ComeyisaPatriot
0,Team Resist or Team Impeach You choose These shirts to let you show your support
0,is hoping on hope ComeyDay ComeyIsAPatriot
0,Who are you kidding tough guy Stolen any more from cancer charities Trust funds do not equate intelligence
0,Even FOX grew a pair on ComeyDay TrumpObstructed ComeyIsAPatriot SenateIntelHearing TrumpRussia
0,CSPAN 2 will rerun entire ComeyHearing at 8 00 ET tonight Every American should watch it ComeyIsAPatriot ComeyDay ComeyTestimony
0,Because none of it exists TrumpRussia ComeyIsAPatriot ImpeachTrump McCainResign
0,Thanks But I ll take the word of Comey over an Elephant killer any day WHCoverup ComeyIsAPatriot
0,I always thought NY covo w law enforcement was to STFU TrumpRussiaInvestigation ComeyIsAPatriot
0,More more I wonder what does Russia have on for him to defend Putinspuppet so ComeyIsAPatriot
0,Why care about Russia MUST WATCH TrumpObstructed ComeyIsAPatriot TrumpRussia
0,Nope ComeyIsAPatriot WeLoveComey You re delusional impeachTrump
0,Nope But we definitely hate your father and you Ivanka and Eric Your day will come too
0,Is it me or does that picture make you want to punch him in the face TrumpRussia ImpeachTrumpNOW notmypresident
0,JustNewToThis is why we are alienated from our world allies why we re no longer the leading nation of the free wo
0,Comey had reported his concerns long before his firing TrumpRussia comeyisapatriot Obstruction That destroys
0,Pence is going down too Life is good PenceIsALiar ComeyDay Comeyhearing FBR ImpeachTrumpNOW resist
0,Kinda shady that the WH released a denial of your dad s lies ComeyIsAPatriot ImpeachTrump
0,Just another GOP WTF Question ComeyIsAPatriot TrumpRussia GOPRussia
0,Trump is a documented LIAR for 20 plus years ComeyisaPatriot GopBS Trumprussia Obstruction
0,Nixon was impeached for dramatically less Trump needs to be impeached obstructionofjustice abuseofpower ComeyIsAPatriot resist
0,He admitted he released one of his personal memos because POTUS was LYING on him Yep He sure did ComeyisaPatriot
0,Yeah ok idiots ComeyIsAPatriot
0,To keep integrity in your own department and what you do have control over ComeyDay ComeyIsAPatriot
0,Who the hell cares ComeyIsAPatriot unlike all of you Keep trying to cover up 2018 just around the corner
0,And why ComeyIsAPatriot That was from the heart Something most if not all sold to Russia
0,impeachpence he lies and is deeply involved in russiagate Comeyisapatriot impeachtrump
0,Speaker Ryan tRump is NOT new to this choosing party over country and bet on your being voted out comeyisapatriot why can t you be one
0,In the final analysis ComeyIsAPatriot DT s concern re Flynn is related to TrumpRussia DT is a LIAR This is all a
0,Hmm believe Comey a man with strong ethics honour and integrity or a known pathological
0,Which one is Curly which one is Larry and who s Moe ComeyIsAPatriot whoaretheseguys
0,Once slimey CrooksnLiars Always CrooksnLiars MONEYLAUNDERING Treason Espionage
0,ComeyIsAPatriot unlike your president
0,I would like to THANK former Director James Comey for his continued service to the Nation He s a true Patriot ComeyisaPatriot
0,Nope The only joke is you and your family TrumpRussia going down Comeyisapatriot something you can t comprehe
0,You calling someone else unhinged is certainly ironic you ignorant treasonous slabheaded prick ComeyIsAPatriot Lumpy
0,JUSTIN BREAKING Omg it s ridiculous that this is even a post ComeyTestimony comeyrockedit we comey
0,Biggest part of ComeyTestimony is that McCain needs to retire Confused himself during questioning Getting old sucks comeyisapatriot
0,No fuzz is such a great phrase Imma use it from now on No fuzz about that ComeyIsAPatriot ComeyDay trump trumprussia resist
0,DonaldTrumpJR Nut Job TrumpLiesMatter RussiaGate ComeyTestimony ImpeachTrumpNOW ComeyISAPatriot trumpfail
0,GOP Could Break With President Donald Trump At James Comey Hearing Mor ComeyDay Bigly ComeyisAPatriot
0,ComeyIsAPatriot 45 is a liar
0,What are you talking about America gets it You sound confused comeyisapatriot
0,Thank you Mr Comey for your service being a Patriot ComeyisAPatriot Happy ComeyDay
0,LET THEIR BE TAPES ComeyHearing NotMyPotus ImpeachTrumpNOW ComeyIsAPatriot
0,THIS ComeyisaPatriot
0,I feel like I can breathe comeyisapatriot
0,JAMES COMEY IS A PATRIOT comeyday countryoverparty comeyisapatriot TrumpRussiaInvestigation ObstructionOfJustice draintheswampromat
0,I wish had 1 10 of the integrity of Comey Country over party PERIOD ComeyIsAPatriot
0,What is wrong with John McCain Losing it ComeyHearing McCainRamble ComeyIsAPatriot TheResistance ImpeachTrump
0,OMG McCain is on crack ComeyIsAPatriot
0,Russia meddled in the election without question ComeyIsAPatriot ImpeachTrump
0,ComeyIsAPatriot Clinton investigation has nothing to do with Russia Clinton was being investigated for using her
0,You know sometimes it is best to put the shovel down and stop digging ComeyIsAPatriot
0,Your dad is having a much worse day ComeyIsAPatriot ImpeachTrump
0,OMG McCain has Alzheimers ComeyIsAPatriot
0,Hottest ticket in town is the Comey testimony hands down no contest ComeyIsAPatriot
0,He s just unbelievable ComeyIsAPatriot TrumpRussia GOPRussia
0,Unfortunate that remain disinterested in protecting American Democracy from Russia
0,Definitely ComeyIsAPatriot TrumpRussia GOPRussia
0,Ignorance of the law is no defense Why are you protecting him What are you afraid will come out ComeyDAY ComeyIsApatriot
0,This is laughable You think anyone cares about when it s ComeyDay comeyisapatriot
0,The world needs a lot more James Comeys right now ComeyIsAPatriot
0,Like him too though ComeyIsAPatriot
0,Nice try Comey is making a solid case for obstruction of justice by ComeyIsAPatriot ComeyDay
0,Cast Iron Set Platinum coated ComeyIsAPatriot and a bad ass
0,New word for today satellite associates Comey ComeyIsAPatriot
0,Wow Hard choice on who to believe Comey or Trump Hands down Comey is credible
0,Are Daddy s fingers broken today ComeyIsAPatriot ComeyHearings
0,Wow someone must have taken your phone away ComeyIsAPatriot ImpeachTrump
0,Is that all you ve got republicans Asking someone being bullied why they didn t stand up to it Trump is a bully ComeyIsAPatriot
0,I m between opportunities now Cast Iron set Platinum coated ComeyIsAPatriot and a badass
0,Meanwhile in the real world ComeyMemo ComeyisaPatriot GOPcomplicit TRAITORS
0,What a patriot ComeyIsAPatriot he is Being THE ONLY PERSON OUT OF ALL OF THEM TO SAY what is really happening wi
0,You are toast DumpsterFire ComeyIsAPatriot TrumpRussia LOCKHIMUP TrumpKKKids GOPrison
0,I think your threat just backfired ComeyIsAPatriot
0,He is proving He goes with law NonPartisan comeyisapatriot
0,Credibility here are all docs rec per memos anything else Hiding something I hope you can let this go ComeyIsAPatriot
0,So he is unfit to serve incapable of governing TrumpRussiaInvestigation ComeyHearings ComeyIsAPatriot
0,please stop trying to blow smoke up our a es TrumpLiesMatter ComeyIsAPatriot
0,There is no question that JamesComey is a patriot ComeyIsAPatriot COMEYDAY Thank you for your service to this county
0,It must be so hard having to repeat the obvious and carefully scrutinize what is obvious over and over
0,Geez Comey REALLY is a Whitehat comeyisaPatriot Trumprussia
0,DO YOU CARE ABOUT RUSSIAN INTERFERENCE ComeyIsAPatriot
0,Release all the tapes I m good with it HOME RUN ComeyIsAPatriot
0,They are coming after America Comey Love countryoverParty Comeyisapatriot Obstruction Trumprussia
0,ComeyIsAPatriot This is America The Russians were coming after our way of life
0,Oh yeah ComeyDay ComeyTestimony ComeyIsAPatriot ReleaseTheTapes
0,GOPMorons They are looking like idiots comeyisaPatriot countryoverParty
0,Good morning pe
0,This Trumprussia Obstruction Comeyisapatriot
0,Today is ComeyDay and COmeyisaPatriot
0,After today s SenateIntelHearing it might be safe to say that ComeyIsAPatriot ComeyDay TrumpRussia
0,No one else was in the room where it happened ComeyIsAPatriot ComeyDay TrumpRussia
0,Listening to ComeyDay I am realizing just how amazing and independent Comey is ComeyIsAPatriot
0,Nice moment of levity ComeyIsAPatriot
0,I must say I haven t aways liked comey because of the emails But ComeyIsAPatriot Truth countryoverparty
0,God Bless Jim Comey CountryOverParty ComeyIsAPatriot
0,That s what you call wag the dog comeyisapatriot
0,It is a beautiful thing to watch the GOP Squirm Comeyisapatriot Trumprussia
0,Whistleblowing is NOT leaking ComeyIsAPatriot Comey
0,ComeyDay ComeyIsAPatriot ComeyIsAPatriot ComeyIsAPatriot TRUMP IS THE TRAITOR LockHimUp
0,ComeyIsAPatriot 45 all about oil
0,Not a Republican or a Democrat thing it s an American thing Comey comeyisapatriot trumprussia Obstruction
0,Comey is impressive ComeyIsAPatriot
0,sticking up for the traitor in chief Impeach45 TrumpRussia ComeyIsAPatriot TrumpIsATraitor TrumpCrimeFamily Complicit
0,GOPScrambling it is sad to watch comeyisaPatriot Obstruction Comey crossing the T s
0,Pay To Play Amway Queen must be Devos d out of our government TrumpRussiaTies ComeyisAPatriot Happy
0,making Missouri look bad go sit down Roy ComeyIsAPatriot ImpeachmentIsInevitable ComeyHearing ComeyDay
0,ComeyIsAPatriot and THANK YOU for getting the truth out about trump flynn stench comes through this computer screen CLEARLY
0,ComeyIsAPatriot Wipe out corruption in the WH
0,comeyIsApatriot Obstruction Trumprussia Trump going down
0,Let s get to those details then ComeyIsApatriot Comey
0,Who lied Look at track record ComeyisaPatriot vs Covefefe
0,ComeyIsAPatriot So why did he kick everyone out of the oval office Comey
0,There is not one person listening to Comey who sees hears anything duplicitous Truth and integrity SHINE ComeyIsAPatriot Thank you Sir
0,This is about America Damn right ComeyDay ComeyIsAPatriot
0,No Donny obstructed justice in quite a few other ways ComeyIsAPatriot ImpeachTrump
0,You are wrong ComeyIsAPatriot ImpeachTrump
0,LORDY please send divine intervention have any and every tape the white house made released thank you see no l
