1,lol this guys mad MAGA vindicated comeyleaker comeyloser
1,Iran supreme leader says attacks fuel hatred toward US Saudis via the Android app Iranians hate Iran MAGA
1,MT The Founding Fathers would be shooting already NRA MolonLabe MAGA TCOT LNYHBT 2A PJNET
1,Agree and please keep tweeting Americans no longer trust MSM MAGA
1,No sean u failed US with yr blind paranoia trump failed by being lying cheat gop failed US
1,Good for you MAGA
1,I just can t imaginary numbers I mean the 1 That s just not possible even in America MAGA oldmantrump
1,We support you but comey did tell the truth but it was about lying Loretta Lynch fake NYtimes MAGA
1,MAGA BABY TrumpRightAgain
1,MAGA keep up the good work don t worry about that viper comey or the grandstandin
1,Only idiots think that disseminating your own thoughts is leaking but then again these MAGA MAGAts
1,Draining the swamp MAGA
1,GabFam MAGA News SpeakFreely USA auspol TeaParty Breaking ComeyDay Cucks The Fake News
1,Failed bloated POTUS Trump is totally delusional needs medication if he thinks vindicated WOW Trump is corrupt MAGA
1,FakeNews FoxNews comically trying to discredit ComeyDay testimony except what Comey said about LorettaLynch MAGA
1,Great reporting by foxandfriends and so many others Thank you MAGA
1,This is the tweet I was waiting for MAGA
1,I guess this means realDonaldTrump was always aiming to be called a liar His idea of Maga and mine really don t
1,trumP responds to Comey FridayFeeling Resistance MAGA TheResistance Resist  Indivisible SCROTUS
1,Breaking Donald Trump is tweeting again HesAwake MAGA Ruuun
1,Searching for relevance As if 1000s of years of identity development could be corrected by 1 with this level of ex
1,Hang in there Concentrate on the Agenda MAGA This BS will blow over Hopeful
1,Who should be prosecuted just like everyone else And btw so should Lynch MAGA
1,Doing something right making swamp monsters squirm MAGA
1,Small business owners are confident about the economy and the future of their businesses MAGA WakeUpAmerica
1,Why the majority of small business owners love Trump s tax plan MAGA WakeUpAmerica
1,But but but she got the popular vote hahahahahaha It is over get out of the way because
1,It s time for to replace Obamacare bring major tax cuts BuildTheWall No more excuses MAGA
1,What the UK election result means for Trump and the US MAGA WakeUpAmerica
1,MAGA BREAKING DJIA Hits New All Time Highs During Nothing Burger Comey Testimon
1,You mean he beat the extremists of the left pushing lies b
1,Nice to see MAGA
1,YOU DA MAN Vindicated MAGA
1,Just keep working hard for the American people We love winning MAGA
1,Love our POTUS MAGA
1,Doesn t like leakers unless they are Russian escorts maga ComeyDay trump
1,Comey aside I m still blown away by how many hot women are pro Trump Just search the hashtags maga jesus guns wife
1,Check your American privilege MAGA BoycottOscar First100Days ProgressiveHaters PresidentTrump
1,Keep up the great work Mr President MAGA CNNFAKENEWS NYTFAKENEWS
1,Good Morning Patriots MAGA ComeyTheLeak Liar POS ProudOfOur StraightTalk ObstrutionistDems
1,The more they try to tear you down the more they reveal their true self Another WIN for you and
1,He is a leaker and should be in jail But Mr please don t tweet about this anymore just
1,THERE YOU HAVE IT COMEY THE COWARDLY LEAKER AMERICANS OUR BEHIND YOU TRUMP DrainTheSwamp SethRich 2
1,The left is so desperate since yesterday didn t turn out the way they expected MAGA
1,Sorry but supporters don t care about facts MAGA notmypresident
1,Three US nuclear capable bombers fly towards Russian border propornot MAGA
1,You go Mr President maga
1,This is the same practice that feminist is always defending womensrights WakeUpAmerica
1,MAGA Poor people
1,The latest Mental Aikido Verum Petitor Thanks to maga tcot
1,Good Morning Mr President I hope You Have a Marvelous Day May God Bless You and Keep You Bless First Family MAGA
1,Waiting on your stroke you fat ass MAGA
1,Poroshenko vows to return control over Donbass coalmines propornot MAGA
1,Can we get back to work now Congress MAGA
1,He means great like MAGA
1,What s next FridayFeeling Resistance MAGA TheResistance Resist  Indivisible SCROTUS
1,Instead of a ToughAsNails Director sounds like unruly schoolboy who was expelled for bad behavior MAGA
1,S amp P Futures At Record High After Shocking UK Election Result propornot MAGA
1,Translations Tim obrien cant let go that he was wrong again and again and again Trump wins MAGA
1,Of course Booby take your illegals and go to Mexico do your part to MAGA by leaving
1,just keeps on delivering DrainTheSwamp Maga ComeyDay ComeyHearings ComeyTestimony
1,New to GoldOutofHiding news MAGA Trump viral ComeyDay downloadfestival
1,MAGA PinocchioPresident Saveourplanet Analysis Trump s misleading claims about new mines clean coal
1,Still doing better than any leftist could dream of resisttheresistence resisthillary
1,GabFam MAGA News SpeakFreely USA auspol TeaParty Breaking Comey Reduced Russia Scandal To B
1,Yes He is Mr President MAGA
1,Is this the true face of the US MAGA bigly racism discrimination MuslimBan
1,Can t comment ON HIS OWN LEAK MAGA
1,Real News MAGA
1,Each of us should keep in mind that Obama s criminal regime callously left four Americans to die in Benghazi MAGA
1,COMEY thought thinks he s smarter than everyone else a real game player Someone like THAT doesn t belong in to
1,Time to shut down this investigation maga
1,We ve always said He s got the book Don t ever doubt Our President and by the way now let s LockThemUp DRAIN the
1,It s a great day in America President Trump MAGA DrainTheSwamp LeoMom BlueLivesMatter
1,LockHimUp Sir He needs to be in jail America can t have the Director leaking to the press
1,Sharon it is disgusting It also proves POTUS has been right all along
1,MAGA don t let rhis butthurt librals get you down keep on trumping on
1,Our perception make up our reality Yours perception is made by the n
1,Drain the Swamp Mr President Thanks for MAGA
1,God Bless you Sir and God Bless America MAGA
1,Truth and facts MAGA
1,Now let s get back to MAGA
1,We are with you Mr President MAGA
1,Moron Chief total vindication FridayFeeling TheResistance Resistance Resist MAGA Indivisible  SCROTUS
1,the looney left will keep making up new lies just ignore them don t even respond to them and do
1,45 isn t the greatest liar though He constantly contradicts himself his spokespeople
1,Ppl who can hear took away this Never under investigation Never colluded Never obst
1,Have a great weekend Snowflakes MAGA
1,ALERT patriots TrumpTrain MAGA Dems outsideGA HUGE 4winHSEseat fmGOP Cons Handel needs Ur HELP tcot ccot
1,Loyal till the end MAGA
1,Victory Lap MAGA
1,Democrats declare white people greatest terrorism threat to America MAGA
1,Stay the Course We Stand With You God Bless You America MAGA USA Si vis pacem para bellum
1,THE MOSQUES ARE OUR BARRACKS BanIslam ReligionOfTerror ENFORCE 1952 MCCARRAN WALTER ACT NOW
1,THESE COMPANIES ARE ABLE TO HANDLE THE COMPLEXITIES AND DANGER OF ISIS IT WAS CANCELLED MAGA
1,YES WE FOLLOW TRUMP PEACE THROUGH STRENGTH MAGA
1,Then your experts would be wrong It was COMPLETELY lawful MAGA
1,In 2020 the is going to step it up and find a candidate who can t stop playing Candy Crush MAGA
1,Trump45 UniPartyLies MSMLies DraintheSwamp MAGA PDJT45 Libkiddy talking points for 6 9 17
1,Then we report it in the West Wing and taking zero salary She will help TRUMP MAGA Love it MAGA Pics by
1,She may have planned more leaks MorningJoe FridayFeeling TheResistance Resistance Resist MAGA Indivisible 
1,all you have to do is look in the mirror snowflake or do you have one that you didnt break MAGA
1,Rubio you earned my respect yesterday You were in fire MAGA
1,phew our twitter in chief is baaaack MAGA
1,foxnewsentertainment should drop off cable TV entirely They have the same concept of truth as
1,I totally agree POTUSTrump MAGA
1,Petulant Childish Democrats Called For Last 4 Presidents To be Impeached TrumpTrain MAGA
1,The latest The Women s Equality Party wepUK Roundup Thanks to maga women
1,Amen Hit your knees and thank God for President Trump every single day He is the ONLY boss that can save us from
1,RT Democrats are falling like flies MAGA Winning ComeyTestimony Comey Trump
1,he perjured himself your tweet was may 11 maga
1,Just imagine that Lordy Comey is a leaker Keep moving your agenda forward President Trump MAGA
1,tgdn MAGA auspol Breaking Comey Reduced Russia Scandal To Beltway Trivia Dick Morris Deep 6 The
1,U S adopted a more advanced form of parody clowns like Pres Cheetohead not required to wear costum
1,FakeNews FoxNews naturally attacking msm for not reporting ComeyDay great for Trump focusing on smearing Comey MAGA
1,Time to MAGA
1,ClintonObamaCult followers is the whole Democrat Society stompITout like
1,Next up let s prosecute Hillary Holder Lynch God bless u MAGA
1,Make America Great Again on Sunday beatMex maga USMNT
1,trumP is tweeting back MorningJoe FridayFeeling TheResistance Resistance Resist MAGA Indivisible  SCROTUS
1,Clean house and remove all these people trying 2 stop ur agenda MAGA DrainTheSwamp
1,This is UNREAL MAGA PREDS PENS LETSGO
1,Go get em POTUS DrainTheSwamp DrainTheDeepState MAGA
1,Your Voice Radio is filled with patriots like FOLLOW THESE PATRIOTS MAGA
1,MAGA Pretty much
1,Make James Comey Reality Winner examples of what NOT to do with over 10 years of jail time LOC
1,MAGA Reality Winner denied bail as security risk took other classified info kept journal expressing support fo
1,Follow Me If You Support Trump Who s Ready to MAGA TRUMPTRAIN
1,Trump wins again MAGA
1,If Comey Memo Is Real He Held It Did Not Turn It Over He May Be Prosecuted TrumpTrain MAGA trumpslegacywillbe
1,Just like those russian hookers youre fond of MAGA
1,God bless you Your patriots have got your six MAGA
1,And he won t know what he did was a criminal act was right in firing him cause it sounds he kept mem
1,Don t mess with the Donald you will always get trumped MAGA
1,So glad you were vindicated You made the right decision in terminating him Onward through the fog Mr President MAGA
1,Looking forward to tweeting all these patriots in one place Love it MAGA Pics by
1,Release the tapes you lying piece of shit You know Comey nailed your fat ass MAGA
1,Trump responds FridayFeeling TheResistance Resistance Resist MAGA Indivisible  SCROTUS
1,Join me tomorrow MAGA
1,I truly want to continue to support you but before you continue tweeting you need to run it by your advisors MAGA
1,There you have it WE MUST REMOVE REPLACE THE UNDERHANDED LEFTOVERS THEY RE HURTING AMERICA S
1,Family compound at GITMO ready FKKKingIDIOT GOPAhole SwampBuddy maga gop tax KGBBOT
1,realDonaldTrump Your supporters think u are doing great things Please don t let MSM libs distract you Continue t
1,you are fulll of shit You lied and it is proven that your research is subpar MAGA
1,And MSM is so Disappointed that Potus is Vindicated Wan wan wan cnnCheats maga ComeyHearings
1,SusanRice still trending must be when millions of Americans who want this country 2 succeed MAGA
1,someone needs to get a handle on you and tweeting your giving the slimy democrats what they want and there at you MAGA
1,Comey is a leaker President was right not to trust him maga
1,Thank you Potus for keeping us safe and MAGA Loving all the work you re getting done this week wh
1,The Truth Is In Your Face But You re Ignoring It mustread ChildSafetyWeek Fridaythought FridayVibes MAGA
1,lordy I knew it all along Now the is lifted maybe just maybe the countr
1,Russian hackers strike again FridayFeeling TheResistance Resistance Resist MAGA Indivisible  SCROTUS
1,Oh My God I just realized that I speak for a nest of slimy cockroaches MAGA TCOT
1,Just in Dumb Reuters mind everyone else except fake media ready to more on and MAGA
1,I knew you were telling the truth we love you President Trump DrainTheSwamp maga
1,Who is next Mr President We need to clean the WH from leakers AG SHOULD BE OPEN INVESTIGACIN
1,The Clinton campaign was more powerful and had higher authority than the Federal Bureau of Investigation Let that sink in MAGA
1,Time 2 MAGA make Leftist cry again support KarenHandel VP Pence GA06 Cobb Energy Center 4lunch speech with
1,Everyday I am president we are going to make America First FridayFeeling MAGA
1,She is a ClintonObamaCult follower stompITout like Islamicterrorist MAGA TRUMP PENCE
1,This is all fault He SHOULD have asked Comey if he d promise to not be intentionally DISLOYAL DTS MAGA
1,The Truth Is In Your Face But You re Ignoring It mustread ChildSafetyWeek fridays FridayThoughts MAGA
1,Comey not the slightest bit ashamed to admit to the world that he is afraid of being alone with POTUS and is cowardly MAGA Covfefe
1,Citizens made their plea too We voted for to secure our borders and enforce our laws MAGA
1,Pretty much sums up these trolltards They ll s
1,FINALLY a judge with a brain instead of empty space Thank you for giving her a safe space now to k
1,Russia is the only story FKKKingIDIOT GOPAhole SwampBuddy maga gop tax KGBBOT
1,God bless our president maga
1,Time to focus on MAGA Let s keep winning
1,Brilliant exchange Thank you MAGA
1,Pardon them all Just get their asses out of there GOPAhole maga gop tax KGBBOT
1,S amp P Futures At Record High After Shocking UK Election Result Retweet MAGA
1,As it turns out the only person trying to influence the election is LORETTA LYNCH ATTORNEY GENERAL Subpoena her ass STAT u idiot GOP maga
1,Here s the unvarnished truth from MAGA TrumpTrain Traitors
1,You are a disgusting Pinocchio A professional LIAR is too bad how many MAGA people believe you
1,Obama filled his cabinet with elitist cronies and experts in teaching Well there are no DUMB teachers in MY cabinet MAGA
1,RETWEET if you still STAND with President Trump is constantly under attack and we need to let him know he
1,says FBI in disarray no faith in Comey Comey testifies mostly that he was shocked stunned Vindicated MAGA
1,Turns out Reality Winner is Muslim She s a member of the Islamic Society of North America and she tried to join th
1,Comey LIED He said he gave memo to Lib Friend one day AFTER the already had and published it LIES resist
1,The latest The White Cop Shoots Black Man Daily Thanks to maga
1,Thank you Mr President our systems are antiquated time to upgrade and privatize MAGA
1,He had a busy day winning yesterday Dodd Frank is gone important legislation to fix VA and Gowdy is now House oversight chair MAGA
1,It s not safe anywhere anymore OITNB MAGA Buckethead
1,Experts have called the period of the introduction of Ukraine visas with Russia propornot MAGA
1,let s not forget the hundreds of drug convicted felons BHO released on a society dealing w massive ODs MAGA
1,Doesn t care Lives behind a WALL on Star Island in Miami OBLIVIOUS with a nothing career like
1,Why does Brian Fallon brianefallon have pic of pipsqueak Stelter on h
1,Donald Jr mis spoke He meant all the things Trump is going to do TO the American people MAGA resistance
1,People that do theses kinds of acts are ClintonObamaCult followers gotta stompITout l
1,Did anyone else hear Comey say he couldn t believe how wrong the MSM sources are wrong Pick up THAT narrative MAGA
1,Despite what the people r waking up in that MAGA ComeyHearing politics tcot
1,Iran Chairman of the Iranian parliament blames US for Tehran incidents propornot MAGA
1,Top 20 CNN News Fails FakenewsCNN MAGA
1,How come so many wimpy men on the Left and so many RINOS on the Right President Trump is the most norm
1,God bless you and safe travels MAGA
1,Comey was fired bc he ignored the corruption crimes and treason in the Obama administration Comey firing Well des
1,Please give Comey a new label Leakin Comey ComeyTestimony MAGA MakeAmericaGreatAgain
1,ARREST THEM ALL MAGA CONNECT THE DOTS Look What Happened To Trump Right After Secret Meeting On Tarmac
1,At this point it s pretty clear that jihadists and democrats are on the same side in their war against civilization MAGA
1,MAGA I m enjoying the silence this morning from the MSM
1,LockHimUp This is what meant about loyalty Comey never leaked against the Admin
1,MAGA He s back
1,MAGA Bill Mitchell Isn t it bizarre that a former FBI Director made the outrageous claim under oath that Trump
1,MAGA How the left work You ll see me today posting the latest spin as they swap out the line up Today it s Wa
1,Comey is a leaker he verified Trump told the TRUTHComey told him not under investigation and never
1,Outstanding tweet maga
1,burns comey down Partisan political hack maga
1,Russia 45 is the biggest farce perpetrated on We the People by MSM who practices Censorship by
1,You did a fantastic job yesterday with all the tweets We in this household read every one MAGA
1,If these are public statements by the President can he legally block people TrumpBlock MAGA
1,BEST THING Left has to sit on the FAKE RUSDIAN STORY What bafoons GO PRESIDENT TRUP MAGA
1,Up bright and Early Pacific Time MAGA
1,Indeed 1400 years out of touch auspol maga
1,thanks for going thu this to MAGA
1,Ok time to put this behind you and focus on MAGA Let the hayers hate and move forward
1,You can tell who s a deranged unhinged liberal by the number of tweets it takes them to ramble the
1,What s next after the Comey bombshells Via ReutersTV klout maga
1,Yes Now ask Sessions to indict him Lynch Rice Clinton and Obama That s the deep state maga
1,We all need to celebrate with some ice cream ComeyTestimony MAGA
1,Articles Bannon Critics Okay with Sharpton Ellison maga
1,I AM NOT A MORON IAMNOTFAKE YOU ARE THE LIBERAL MORON WHO IS ENVY OF HIS
1,We knew u would be vindicated Now let s forge ahead and MAGA despite the unhinged left TaxReform Healthcare
1,USA What happened when I tested out 7 different hair oils MAGA womenshealth health
1,And we won gl with your impeachment fantasy MAGA
1,Small business owners are confident about the economy and the future of their businesses MAGA
1,Don t blame me blame Democrats they re the ones thinking it s a good idea to wear a Vagina on your head FoxAndFriends DrainTheSwamp MAGA
1,GabFam MAGA News SpeakFreely USA auspol TeaParty Breaking TOL Vlog ABC news reedits Comey
1,AntiTrumpers sound like a broken record singing the wrong l
1,The Truth Is In Your Face But You re Ignoring It mustread ChildSafetyWeek NationalBestFriendsDay MAGA
1,Why are you behaving like a five year old MAGA
1,Now let s see a witch hunt against the democrats They are the guilty ones MAGA
1,Let the tweeting begin MAGA resistance
1,Thank you Mr President We knew you would be vindicated Forget the left msm distractions Keep
1,For me personally a few too many Comey I don t knows and no real smoking gun Annoyed with the whole thing Lets get back to Maga
1,I agree the RINO s need to be exposed so we can move forward to MAGA
1,Trump is a winner This feels like election night all over again MAGA
1,Day after ComeyHearing it is time for repubs to wrap it up There was no TrumpRussia collusion START GOVERNING draintheswamp MAGA
1,Despite so many false statements and lies I am still President of the United States comey trump russia flynn maga
1,God bless you now maybe you can continue to focus on this country and the people who appreciate you MAGA
1,New Post Uber Exec Fired After Sharing Woman s Medical R MAGA draintheswamp crookedhillary hillaryforprison
1,Going to need lots cash for honey buns and jerky in her commissary account where she s going RealityWinner MAGA
1,And here was losing it They also had bets about what time would tweet Ridiculous FakeNews
1,It is time this coward is removed from his position We the people a
1,Pssst is your President Dont forget to MAGA
1,If NYT WaPol prints TS leak they KNOW is false is that 1st amendment protected or se
1,MAGA folks tell your President to release the tapes and prove that he is not a liar
1,Only one who obstructed justice was Lynch Wishful thinking though sorry bout that MAGA Trump
1,The Truth Is In Your Face But You re Ignoring It mustread ChildSafetyWeek FridayKazini FridayMadness MAGA
1,Muslim refugee 20 thought it was coming sooner than later MAGA TrumpTrain Dobbs
1,Be FIRED By Was The Best Decision MAGA Comey Admits He was Too Cowardly to by BarbaraNsgstud
1,Making America Great hottiefortrump babefortrump babesfortrump maga trumppence trump trump2016
1,You re busted asshole Treason MAGA
1,MAGA Top Ten Facts From Comey s Testimony
1,The latest TWITTER TATTLE DAILY Thanks to maga entrepreneur
1,He said he lies continuously Liars Grifters GOPAhole FKKingIDIOT maga gop tax KGBBOT
1,It time for Richman to produce the memos richman to testify and jail for Comey all comeytestimoney MAGA
1,When it s all over the Clintons and Trumps will be friends again proving how stupid Americans are MAGA
1,With these Buffoons in power America wakes up to this every day Offer you can t refuse MAGA TCOT
1,So I saw this on YouTube and OMG The accuracy of Donald Trump MAGA
1,The Truth Is In Your Face But You re Ignoring It mustread ChildSafetyWeek FridayFact fridaygiveaway MAGA
1,No excuses That s all you do when you make mistakes Keep your spine straight and stop bein
1,There was nothing to clear the entire rancid story was a complete fabrication from the start FAKE
1,Charge and MAGA
1,let s not forget about the magic MAGA touch
1,Basically You re grabbing at straws Keep up the resistance The rest of us need to b
1,The latest The Conservative News Daily Thanks to trump maga
1,behind my President Never believed him when he never indicated crooked Hillary MAGA USA
1,maga Please take 30 seconds and watch this healthcareisaright
1,Look at all the butt hurt Leftys that thought Comey was going to be Their hero Time to move th
1,Witches Gather At California Park To Hex President Trump signs two executive orders today Day1Promises Obamacare MAGA
1,Your voters appreciate all that you do We pray for you your family and entire admin Please st
1,NEW TWITTER ALERT You Were Mentioned in a Senate Hearing lace up your lying shoes TrumpRussia
1,MAGA Just me or is T_D abnormally high energy this week So many 10k posts
1,MAGA Paul Joseph Watson BREAKING Russia hacked the UK election to help Comrade Corbyn I ve no actual evidence
1,MAGA the far left has dehumanized everyone who doesn t agree with them and views people as tools or enemies the
1,MAGA Liberal response to terrorist attacks
1,Keep her the hell locked up MAGA
1,MAGA Islamic radicals in Ireland now number 100 or more warns cleric
1,Here s Why You Should Watch Doug DeMuro s Car Review Videos DougDeMuro TRUMP MAGA Cars Jews BlackLivesMatter
1,Hmmm Silly LibDems think they can censor us HAHAHA I m old school a holes We spread the word the old fashion way In person MAGA
1,Nice to see how classy the President in blocking clueless nitwits who disrespect the Sitti
1,MT God Bless The USA WakeUpSnowflakes OneNation InGodWeTrust MAGA 1A Freedom 2A PJNET
1,Comey showed this was all sour grapes and why he needed to be fired Time to move on now and maga
1,Whooo Go President Trump MAGA
1,Keep fighting for us Mr President Drain the swamp MAGA
1,SAN FRANCISCO The Social side of global FreeSpeech Via Twitter maga
1,GodBlessAmerica TheDuke JohnWayne MAGA See how many U remember can name
1,Lame Brain McCain Ignores Comey Confessions Still Wants Select Committee MAGA
1,Always believed he was placed there on purpose very weak man Drain the swamp Mr President maga
1,He is also a YUGE WHINER Poor Chris Matthews even he now admits all this Russia cra
1,Trump supporters are always telling people to get jobs yet they are always tweeting I m guessing it s from mom s basement MAGA
1,The left are truly idiots NYTIMES and CNN apologizing PRICELESS LAST DITCH effort fro
1,OMG Comey should ve been wearing a Pink Pussy Hat FoxAndFriends DrainTheSwamp MAGA
1,It all depends on your agenda MAGA or continue to flush our country down the toilet
1,100 correct Only issue I have with that sentence is the grammar it s
1,Please enjoy MAGA Scroll memes top engaged members Grow followers
1,In China making MAGA hats tRump suits Ivanka s sweatshop clo
1,LOVE U TRUMP MAGA DrainTheSwamp
1,Who within the FBI supported sickly Comey This 6 8 Anti American Pity Party disrespected the office of the POTUS Lynch Leash Matter MAGA
1,Mr Comey and All the President s Lies Impeach45 LiarInChief MAGA
1,You are not MAGA You are denigrating our country Stop it
1,You ve done nothing but pick the fox to guard the henhouse at EPA Justice etc draintheswamp
1,You are lying sackofshit all you do is lie no one believes you and soon you will be impeached y
1,Pedophile Howdy Doody fetishist lied a b 650k docs synced2 AwanBrothers Good luck w that when
1,I thought Chump liked leakers especially Russian prostitute leakers MAGA TrumpIsIncompetent Trump
1,It s about time someone in D C besides our is taking their job seriously MAGA
1,maga HRW Hi on 6 7 Feb 17 The independent UK published my legal complaint
1,haters gonna hate liars gonna lie leakers gonna leak thanks for helping us maga we love u mr president
1,I have a question why wasn t Comey wearing his Pink Hat It would ve been appropriate he was sexual
1,Oh you judge favorability by tweets Hilarious All of MAGA Deplorables aren t goin
1,Drain the swamp MAGA
1,will y all stfu now and move on to actually MAGA Stop your bs
1,I don t care what your belief your love whatever We have one country I support you I m a d
1,When does Theresa May blame Putin Retweet MAGA
1,For the record Trump is still undefeated winning maga
1,Israel flouting numerous UN resolutions and conventions Analyst propornot MAGA
1,Vindication is right of MSM still spin the BS like some of the comments the FLAKE are making
1,Nice to have the expressing his thoughts again Nice that he keeps us in the loop MAGA DrainTheSwamp
1,No loyalty with Comey Trump was right by firing him MAGA
1,Now they re MSM should ve supported Why support Makes no sense If we re all Americans
