0,FAKEASSNEWS from BOT ComeyGotTooCLOSE tRumprussia tRumpLEAKS tRumpLIES tRumpsTAXES AH
0,I went to Russia with and he tongue punched my fart box TrumpiLeaks TrumpLeaks bald
0,Because donTheCON s a plain and simple ComeyGotTooCLOSE ComeyKnowsTooMUCH tRumprussia
0,COMEY TAKE A LOOK AT DONALD TRUMP ROY COHN ROGER STONE THEIR NAUGHTY BOY LINKS
0,Yikes vindicated TrumpLeaks ComeyTestimony
0,RT funder TrumpLeaks Docs Sen Lindsey Graham s super PAC took 800 000 from a pro Putin Ukrainian businessman i
0,RT funder TrumpLeaks Docs Sen John McCain s super PAC took 200 000 from a pro Putin Ukrainian businessman in 2
0,TrumpLeaks Docs Sen Lindsey Graham s super PAC took 800 000 from a pro Putin Ukrainian businessman in 2015 TrumpRussia TrumpObstructed
0,TrumpLeaks Docs Sen John McCain s super PAC took 200 000 from a pro Putin Ukrainian businessman in 2016 TrumpRussia TrumpObstructed
0,TRUMP IMPEACHMENT ComeyDay ObstructionOfJustice trumpleaks
0,Naturally That was a pre qualification for the job No Russian buddy no job TheResistance impeachtrump
0,RT funder Steve Bannon was illegally paid 950 090 from super PAC during campaign I reported to FBI trumpleaks
0,Ugh Noooooooo First Chaffetz now Gowdy resist factsmatter Trumprussia TrumpLeaks
0,Which is precisely why he had no business being the fucking president in the first place TrumpLeaks
0,And other matters Jared knows nothing about has advised Trump incorrectly TrumpLeaks trumprussia resist
0,Of course IT lied It cannot help itself TRumpLies TRumpRussia TRumpLeaks TRumpRussiaCoverup
0,This is what no drama looks like the other guy will never be him
0,Did someone steal phone No tweets all day This has got to be a record ComeyDay
0,Two Dumb Trump Tweets Are Eating His Presidency Alive ComeyDay TrumpRussia PenceRussia TrumpLeaks Twitter
0,Hey Hannity ask Don Jr about this TrumpLeaks TrumpRussia TrumpObstructed
0,There s 2 people there FakeNews ComeyHearing TrumpLeaks
0,What planet did these assholes come from people there obviously lack dignity or a conscience trumpLeaks TrumpRussia
0,Republicans spent 8 years mocking the word Hope and now want to cling to it like a lifeline comeytestimoney ComeyFiring TrumpLeaks
0,Please read SCOTT DWORKIN trumpleaks MANY GOP BEING LINKED TO RUSSIA DEALS and from RUSSIA SO OF COURSE BACKING
0,is baiting 45 so badly It s spectacular ComeyDay ComeyHearings TheNatureOfThePerson TrumpRussia TrumpLies TrumpLeaks
0,Sources say sources say sources TrumpLeaks impeachTrump impeachTrumpPence Trump
0,TrumpLeaks Trump must be itching to Tweet Nothing to Say NOW
0,Loco Orangesky along with republicans are taking away health care from millions trumpleaks trumpcare ahca healthcare aca
0,Karma s been busy but she s catching up to TrumpLeaks because the US needs to be saved from Trump his obvious
0,TrumpLeaks TumpLies TrumpLied TrumpLiesMatter to all of US Not MyPresident NeverTrump PissOffTrump
0,nomorecred with this admin laughingstockoftheWORLD trumprussia notmyfhrer
0,Sundowners Stroke Exhaustion from being a Trump apologist in action not words Follow t
0,Benedict Donald doesn t have the attention span or discipline to sit still ComeyTestimony releasethetapes
0,way to hire a superstar TrumpCrimeFamily TrumpRussia TrumpRussiaCoverUp TrumpLeaks
0,liar in chief and his corrupt family need to go trumpleaks trumpcare ahca healthcare aca
0,Troll level Grandmaster Flash ComeyDay Comey ComeyWeek TrumpRussia TrumpGOP ResistTrump TrumpLeaks fbr
0,the so called president and republicans traitors together trumpleaks trumpcare ahca healthcare aca
0,Imagine if President Obama had done even ONE of the things we know TrumpLeaks has done Obama never
0,Do you Care about this trumpleaks
0,No bail Accused NSA Leaker RealityWinner To Remain In Jail Pending Trial Pled Not Guilty trumpleaks leaker
0,TrumpLeaks Exposes Trump Jr s Russian Speechmaking by
0,Me when McCain asked Comey questions today ComeyHearing ComeyHearings ComeyTestimony trump TrumpLeaks
0,Co ordinates w your information trumprussia Trumpleaks resist
0,Let s hope it s LIVE Kushner has a LOT to answer for tapes to explain EB 5 s to answer for that TrumpLeaks gav
0,TrumpRussia is happening no matter where the looks Cannot be denied TrumpLeaks
0,We all know TrumpLeaks lies as he breaths Comey has no reason to Of course Trump is NOW under investigation
0,2 In theory we have important norms against this but I think Trump has the legal authority he said trumpleaks resist
0,As if we needed MORE PROOF that GOP work for and answer to the 1 not WeThePeople IBelieveComey not the liar
0,Trump never pays his own Bills steals free labor of PEOPLE so why wouldn t he steal form TAXPAYERS TrumpLeaks
0,Ever wonder why defends Donnie so much Paul Ryan has a price tag of 100 000 TrumpLeaks
0,Like her or not Hillary isn t under any investigation unlike TrumpLeaks Trump criticized NATO re but didn t
0,SethAbramson Too much covfefe will do that to you TrumpRussia ConfictOfInterest TrumpLeaks DonTheCon
0,LoseCruz couldn t even stand up to TrumpLeaks when he claimed His dad killed Kennedy Still kiss
0,IBelieveComey not a known liar TrumpLeaks Wonder if Trump pays this lawyer He owes others MILLIONS in debt not p
0,We have a tape too TrumpLeaks
0,regram courtneyclift trumpleaks twinleaks trumplies liarinchief donthecon
0,ComeyHearings Comey is the guy you laugh and joke with during coffee break but who could bad mouth you in a minute Trump TrumpLeaks
0,Does this give better meaning to the word hope from the President ComeyDay
0,For the Senators on the Hill charging is a LIAR remember this guy trumprussia trumpleaks impeachment
0,He can t talk or tweet when ASS is puckering ComeyTestimony ComeyDay TrumpRussia TrumpLeaks
0,Plz reply to this with every reporter news handle u can find in GA NEW TrumpLeaks on Handel NOW GA06
0,I m Launching TrumpiLeaks Michael Moore TrumpLeaks trumpregrets Democrats democracy AmericaFirst
0,Unless Russians are hacking their voters also If it happened here and in France it c
0,This one is just as guilty as TrumpLeaks Remember Pence used campaign 1st run to pay his Mortga
0,Armchair Trump prosecutors all of Twitter today ComeyTestimony TrumpRussia TrumpLeaks Kill the lawyers Brin
0,TrumpLeaks Exposes Trump Jr s Russian Speechmaking is the story that made DonaldJTrumpJr block me https t co hU2ck01Hpt G
0,Will TrumpLeaks pay this lawyer or is he just another Lawyer to file suit later for NONPAYMENT as Trump is a KNOWN deadbeat LIAR
0,IBelieveComey not the chronic liar TrumpLeaks There was no Privilege there was Trump ignorance to ASK an FBI If he was caught yet
0,SHAME on buying into the KNOWN LIAR TrumpLeaks when Trump constantly lies it s expected his Attorney will l
0,They re still hard at work stripping millions of Americans of their healthcare keep the pressure on
0,it s NOT Classified material ya bad hair dumb fuck Lewandowski ComeyHearing TrumpLeaks msnbc
0,TrumpLeaks Exposes Trump Jr s Russian Speechmaking by TrumpRussia Trump Family Kleptocracy
0,TrumpLeaks ComeyTestimony Leaks WhistleBlowing is a lynchpin of Truth Remembering Watergate PentagonPapers LoveCanal ErinBrockovich
0,Too right Must be a family trait TrumpGate TrumpRussiaCoverUp TrumpLiesMatter TrumpLeaks
0,The act of creating memos 4 future leaks is seditious insubordinate Giving a false reason for it under oath
0,TrumpLeaks Exposes Trump Jr s Russian Speechmaking is the story that made block me
0,FBI director admits he was a leaker Sacking was justified TrumpLeaks usa auspol
0,WhiteHouse on Lockdown After Trump Hurled TV Out Window The New Yorker Resistance TrumpLeaks plenty Resist
0,DonaldJTrumpJr We the People would like for your Dad to do his job but TrumpLies and TrumpLeaks get in the
0,Amazed that requires an attorney to speak for him Getting worried or his twitter thumb broke TrumpLeaks
0,Well prosecuteComey SpecialCounsel MAGA DrainTheSwamp TrumpLeaks TrumpiLeaks
0,And Trump s sycophants would say She asked for it TrumpRussia TrumpLeaks ImpeachTrump TrumpObstructed
0,EDITORIAL ComeyHearings Mired in a quagmire of lies Trump can no longer be POTUS
0,that moron will destroy our planet We need to fight back trumpleaks ComeyHearings comeyday jamescomey
0,EDITORIAL ComeyHearing Mired in a quagmire of lies Trump can no longer be president
0,When you have a president with a mind like a steel sieve you don t need leakers Don t shoot the messenger TrumpLeaks
0,that orange guy scary because he wants to be a dictator trumpleaks ComeyHearings comeyday jamescomey
0,Maybe you ll be able to visit him in Leavenworth
0,FFS This man cannot speak without hyperbole Trump TrumpLeaks
0,I m sad that JamesComey didn t start with Many Bothans died to bring us this information shudders ComeyDay StarWars TrumpLeaks
0,Fuckface Von Clownstick every day and another WTF trumpleaks ComeyHearings comeyday jamescomey
0,I still stand by my video What I think about Trump ComeyDay ComeyHearings TrumpLeaks TrumpRussiaInvestigation
0,No no no Comey told simply the true Why are you closing your eyes and don t want listen to him Why TrumpLeaks
0,TrumpRussia are guilty of Treason TrumpLeaks ComeyDay
0,Does an asswipe qualify as a person TrumpRussia TrumpLeaks ImpeachTrump TrumpObstructed
0,Speaking of leakers my depends undergarments are full ok TrumpLeaks Depends Pee
0,Well imagine that TrumpLeaks ComeyDay
0,Account for This Please trumpleaks trumplies
0,New Charge for the Democrats Investigate Trump for Drugging Comey TrumpLeaks FakenewsCNN Conservatives Liberal
0,NationalBestFriendsDay Putin s rubles bought him TrumpTheLiar StrangeBedfellows TrumpLeaks PeePeeTape EmolumentsClause
0,Maxine you are a hero We You TrumpRussia TrumpLeaks
0,The excuse Trump is new to the job is bullshit That s tired over used if he wasn t president he would have been fired trumpleaks
0,FoxNewsResearch Best Place To Stay Informed ComeyHearings ClintonInvestigation TrumpLeaks TrumpRussiaInvestigation TrumpVindication
0,Once again he s right way before anyone else sees it and they found another leaker today TrumpLeaks
0,But he is TrumpLies TrumpLeaks DumpTrump ImpeachTrumpNow trumpfail
0,That s all u got Time to get to work on displaying the maggot 4what he really is
0,Maybe You Can Oversee This trumpleaks trumplies
0,And all the hookers in DC just breathed a collective SIGH of relief TheResistance TrumpLeaks
0,I don t believe ANYTHING says HE LIES TrumpLeaks comeytestimoney He is a weasel The world is laughing at you Sad
0,The most important Comey takeaway is that congressional Republicans don t care ComeyHearings TrumpLeaks resist
0,Unstable JamesComey clearly suffers from TDS Trump Derangement syndrome SenateIntelHearing TrumpLeaks FBI
0,Lordy Comey was a private citizen when he leaked info to defend himself against TrumpLies TrumpLeaks in WH JamesComey ComeyDay
0,OH NO Russians Sessions comeyhearings trumprussia trumpleaks
0,comey trumprussia jamescomey trumpleaks Mccain lyindon
0,WARNING Don t believe a word he says TrumpLeaks and TrumpLies White house has no credibility
0,Comey Says He Asked Friend to Share Memos on Trump Talks With NYT Reporter ComeyHearing trumpleaks
0,I believe the word you are looking for is clusterf amp k Comey Kasowitz TrumpLeaks
0,No maybe you shouldn t of made the Trump Loyalty Pledge trumpleaks
0,Trump halts stream of tweets hires lawyers Interesting stuff TrumpLeaks
0,With so many bribes to pay off is it any wonder TrumpLies TrumpObstructed TrumpLeaks
0,Depends are coming in handy for Trump today unusually quiet TrumpTwitter world TrumpLeaks ComeyDay
0,TheResistance TrumpLeaks ComeyDay Trump s Lawyer When Trump colluded with Russia he didn t do it and if he di
0,No you re the leaker no you re the leaker cnn news TrumpLeaks
0,Started with Predisent continued with errors and ended with this Must be on the same drugs or missed meds a
0,Liar liar pants on fire Can t even read his pre scripted message right ComeyDay TrumpLeaks Kasowitz
0,Trump s lawyer quoting quote closequote TrumpLeaks ComeyTestimony
0,DumpTrump when your attorney takes a bow wait why does TrumpLeaks need an attorney CNN
0,So much LOVE from so many BOTS how do you do it LMAO TrumpRussiaCoverUp TrumpLeaks Traitor Treason
0,We will not be taking questions is the new E Pluribus Unum ComeyDay JamesComey TrumpLeaks TrumpLawyer
0,This Marc Kasowitz guy looks like a maniac much like the rest of the company Trump keeps Blah blah word salad TrumpLeaks
0,It s Over The Republican Party is now officially the Russian Party Donations Welcome trumpleaks
0,TrumpLeaks confidential info to Russians from Israeli security Kasowitz is a criminal at
0,Please do go on spewing GrOPer swamp rhetoric FOOL
0,Ohhh ok trumpleaks
0,Yeah what a wino ComeyGotTooCLOSE tRumprussia tRumpLEAKS tRumpLIES
0,Ex FBI chief James I was fired over Trump Russia probe FBI JamesComey TrumpLeaks Russia Putin impeachment
0,Did Trump have a Flynn with Comey Have I read it wrong ComeyDay ComeyHearing TrumpLeaks
0,Trump told Russians about Comey because he has brains made of covfefe Nonexistent like the fake word
0,trumprussia trumpleaks fucktrump Yeah so MaCain WTF are you talking about
0,ComeyTestimonySurprises admitting he leaked his own documents is bizarre and destroys his credibility Weird TrumpLeaks
0,Idt you want to be making a go to the mattresses reference for trump right now ComeyTestimony Godfather TrumpLeaks
0,Support RealityWinner whitehousewatchlist notmypresident leaks trumpleaks trumpsHitList resist
0,Lindsey Graham For shame You need to unhitch your political wagon before it is too late TrumpLeaks ComeyTestimony
0,Yep We d expect charges from or Rosenstein no trumpleaks TrumpRussia
0,so release the tapes Then we will know Easy peasy trumpileaks
0,Meanwhile the WhiteHouse TrumpLeaks Abound VERY NICE ATTEMPT YOU IS S M R T
0,We have exclusive footage from inside Trump s mind as he remembers where he hid secret tape recordings of Comey
0,Spot on MAGA Hannity TrumpTweets TrumpLeaks
0,Only one leaking DonaldTrumpJR is your dad TrumpLeaks ComeyDay Comey ComeyHearing
0,ComeyDay COVFEFE ComeyCrazy Sweeps Washington From Union Pub FBI Director Admits Orchestrating TrumpLeaks
0,To Trump the Russia matter is a cloud that hangs over his presidency ImpeachTrump trumpleaks trumprussia
0,The mental gymnastics the and tcot are conducting over the ComeyHearing are worthy of a gold medal Trumprussia TrumpLeaks
0,Russia was a cloud over me I got rid of the nut job Comey now that pressure has been lifted He scr
0,Today we have found the leakers cnn ComeyTestimony comeyHearings Comey Trump TrumpLeaks
0,Trump trumpleaks
0,You know what s not funny the way you bash people and then claim you ar
0,4 then you can understand what real Americans face Until then STFU Resist TrumpLeaks ITMFA
0,SenJohnMcCain took Russian money per TrumpLeaks yesterday TrumpRussia TheResistance
0,John McCain was like Hillaryleaks and TrumpLeaks are both Collusion comeyHearings ComeyDay JamesComey Comey
0,Southern Command in CostaRica US Occupation Disguised as Humanitarian Aid MarshallPlan
0,Comey wanted to impeach Trump It s that simple TrumpLeaks TrumpRussia Trump
0,Come out and play Donnie J ImpeachTrump resist TrumpLeaks trumplethinskin unhingedlunatic
0,The problem with being able to watch the ComeyHearing while peeing is its very hard to not rage pee all over the s
0,Trump resists his Twitter fix trumpregrets TrumpResistance TrumpRussia TrumpLiesMatter TrumpLeaks
0,I assume we all agree with this Trumpers comrades MAGA Hannity TrumpLiesMatter TrumpLeaks TrumpTrain
0,Trump TrumpLeaks Donald Trump lies as fat he is trumpout He is a disaster and dangerous for our world
0,Just gonna leave this here for you Jr ComeyGotTooCLOSE tRumprussia tRumpLEAKS tRumpsTAXES AHC
0,Is James Comey telling the truth ComeyDay ComeyTestimony Comey comeyHearings JamesComey TrumpRussia TrumpLeaks
0,Just made herself one resist ComeyDay ComeyTestimony TraitorTrump TrumpRussia TrumpLeaks INDIGENOUS
0,Only used the b word bc it rhymes w mitch You re welcome to improve on it tho ComeyGotTooCLOSE
0,Pretty much MAGA Hannity TrumpLiesMatter ComeyTestimony TrumpLeaks
0,Comey just consented to the release of All Tapes between Trump and him ComeyDay TrumpLies TrumpRussia TrumpLeaks
0,One NOT asked Why WASN T 45 personally investigated ComeyTestimony ComeyDay resist DonTheCon TrumpRussia TrumpLeaks MAGA
0,One NOT asked Why WASN T 45 personally investigated ComeyTestimony ComeyDay resist DonTheCon TrumpRussia TrumpLeaks
0,Follow the money Always TrumpLeaks Exposes Trump Jr s Russian Speechmaking by
0,Marco Took the Loyalty Pledged trumpleaks comeyday
0,Follow The Money trumpleaks comeyday
0,Weird trumpleaks
0,ANYTHING to DIVERT TrumpRussia TrumpObstructed TrumpLeaks
0,Yeah that doesn t sound guilty ComeyDay ComeyTestimony
0,The Scandal Hiding In Plain Sight POLITICO CrookedDonald RussiaGate TrumpLeaks putinspuppet
0,Can Sure Tell YOU Took Trumps Loyalty Pledge trumpleaks comeyday
0,I certainly hope so Resist trump ImpeachTrump MAGA TheResistance TrumpTrain
0,Trump a history of recording ppl TrumpRussia TrumpLeaks
0,You Take Trumps Loyalty Pledge How s Bernie trumprussia comeyday trumpleaks
0,James Comey lordy I hope there are tapes ComeyTestimony TrumpRussia TrumpLeaks
0,There you go what more do you need to hear Resist trump ImpeachTrump MAGA
0,I m waiting to see how FOXNews is going to spend this Resist trump ImpeachTrump MAGA TheResistance TrumpTrain
0,Comey keep notes because he was afraid Donald Trump was going to lie about their conversations Resist trump
0,And that s a good thing Resist trump ImpeachTrump MAGA TheResistance TrumpTrain TrumpLeaks
0,TrumpRussia TrumpLeaks RESISTANCE MAGA I ll take my TRUMP steak with a side of Mar a lago and ALL his other assets
0,trumpleaks oops
0,Comey HAD TO WRITE IT DOWN cause he didn t trust the snake tRumprussia tRumpTreason tRumpLeaks
0,Let s go to Trumps golden showers tapes Resist trump ImpeachTrump MAGA TheResistance TrumpTrain TrumpLeaks
0,YES Trump created this chaos he should shoulder the consequences TrumpLies TrumpColluded TrumpLeaks
0,Stop You Must of Taken Trumps Loyalty Pledge 40million Reasons comeyday trumpleaks
0,Trump is not a patriot He is a goddamn TRAITOR ImpeachTrumpNOW NotNormal TrumpLeaks TrumpRussia
0,Retweeted Scott Dworkin funder TrumpLeaks Docs Sen Lindsey Graham s super PAC took 800 000 from a
0,Fuckface Von Clownstick hates Obama so much he will destroy our world out of spite trumpleaks ComeyHearings comeyday jamescomey
0,Read ComeyTestimony ComeyHearing comments Trumprussia TrumpLeaks Indivisible amjoy maddow inners
0,ComeyHearing Trump keeps saying he wanted out f under the Cloud Could it be this cloud TrumpDossier TrumpLeaks
0,And Trump starts shitting his pants Who wouldn t comeyday russiagate notmypresident TrumpLeaks Impeach45
0,I don t know Sarah Huckabee could sing Resist trump ImpeachTrump MAGA TheResistance TrumpTrain
0,The latest The real housewives dish Daily trumpleaks trumprussia
0,Newest OccupyDemocrats podcast co hosted juancuba with special guest funder discussing TrumpLeaks TrumpRussiahttps t co EL51TaOfZt
0,Stop You Must have Taken the Loyalty Pledge 20 million reasons trumpleaks trumpspuppet
0,Live blogging today on ComeyTestimony ComeyHearing Trumprussia TrumpLeaks Indivisible NotMyPresident amjoy
0,Why did 45 attempt to shut the investigation of Flynn down Flynn implicates Jared 45 protecting Jared TrumpLeaks impeachment
0,Who s waiting for a BIG PIECE of JUICY tRumpRoast Meeeee TheResistance TrumpRussiaInvestigation TrumpLeaks
0,TheResistance Resist TrumpLeaks FakePresident totally made my day thank
0,So worth the read comeyday ComeyTestimony comey trumprussia ThursdayThoughts TrumpLeaks Resist
0,There s proof of Trump having sex with a underage girl Resist TheResistance ReleaseYourTaxes TrumpSexTape
0,Remember when He s a Businessman was considered a virtue not an excuse TrumpLeaks RussiaGate ComeyTestimony
0,Showing in an internet near you soon TrumpLeaks
0,Time to fuck up some Nazis ComeyHearing TrumpLeaks SallyYates
0,10 Breaking if Lozansky means nothing why did the director of the CIA Respond to this TrumpRussia Trumpleaks
0,Trumprussia SteeleDossier TrumpLeaks DonTheCon Indivisible Resist ComeyHearing
0,Before now ComeyDay TheResistance TrumpRussia investigatetrump resist AntiTrump TrumpLeaks
0,Trump s google search this morning TrumpRussiaInvestigation comey ComeyBowl TrumpLeaks Trumprussia
0,And Bernie went to jail ComeyDay TheResistance TrumpRussia investigatetrump resist AntiTrump TrumpLeaks
0,Happy Comey Day ComeyDay TheResistance TrumpRussia investigatetrump resist AntiTrump TrumpLeaks
0,Well said His daddy got 5 deferments back in the 1970s ComeyDay TheResistance TrumpRussia investigatetrump
0,What happened to Coats Rogers They became hyper sensitive dodgers
0,Unusually quiet this morning Anything on your mind ComeyDay TrumpObstructed TrumpLeaks
0,It s ComeyDay Get ready for the most grotesque version of Watergate TrumpWaterloo Flynnished Watergate2
0,No Tweets this morning Did they take your phone away again Awww TheResistance TrumpLeaks
0,Happy ComeyDay TheResistance TrumpRussia investigatetrump
0,No they are not they are shitting their pants And she wore white TheResistance TrumpRussia
0,Mornin Looking forward to your thoughts about the latest TrumpRussia FlynnGate TrumpLeaks revelations MorningJoe
0,The Armenian Lobby and US Foreign Policy TrumpRussia TrumpLeaks
0,Chris Wray is tainted his office works for rosneft TrumpLeaks resist resisttrump
0,Comey about to sing his song Smoke is smelling stronger than strong Comey Trumpleaks TrumpLies
0,I can t wait till tomorrow TrumpLeaks ComeyHearing ObstructionOfJustice
0,The DonaldTrump Criminal Syndicate Trumprussia TrumpLeaks TrumpPutin
0,Alleged leaker s parents fear Trump will be tough on case from RealityWinner TrumpLeaks
0,Most Americans didn t vote for an orange haired buffoon TrumpLeaks TrumpImpeachmentParty
0,You like this pic don t you Don POTUS TrumpLeaks TrumpDementia ParisAccord shameontrump PoorUSA USA
0,Comey s caution to meet Trump s tweets in Russia hearing Comey TrumpLeaks
0,If only Trump TrumpLeaks Get out moron
0,Quite sure you watch plenty of FAUX news GrOPer swamp ComeyGotTooCLOSE tRumprussia
0,You love Cotton Hill ComeyGotTooCLOSE tRumprussia tRumpLEAKS
0,POTUS calls TrumpLeaks fake news Then covfefe and time to snooze
0,POTUS calls TrumpLeaks fake news Then covfefe and it s time to snoo
0,How did you reach this conclusion of respected TrumpLeaks TrumpRussiaCoverUp TheResistance
0,Go Comey go TrumpLeaks Trump FBI
0,Hope y all enjoy Resistance HeroesResist GeeksResist DA My alter ego made it TrumpLeaks Comey
0,This is excellent thanks for saying what I ve been thinking resist TrumpRussiaCoverUp trumpRussiaCollusion
0,Does Wray promise to be loyal to you If so he s toast TrumpLeaks
0,This seems important because it is do unlikely Great job TrumpRussia TrumpLeaks ImpeachTrump
0,I am muting you resist TrumpRussia Trumpileaks TrumpLeaks TrumpRussiaInvestigation TrumpRussiaCoverUp Russiagate
0,Against GOP principles of corruption TrumpRussia TrumpLeaks ImpeachTrump
0,So is 7 am too early to pop popcorn ComeyDay trumpobstructed TrumpLeaks
0,TrumpTowers was the hackers place To bitcoin Trump thru the race TrumpObstructed impeachTrump TrumpLeaks Dems
0,they did get paid by the vlad i mean the john RussianHookers GoldenShowers TrumpLeaks Resistance
0,DT has no higher instincts resist ImpeachTrump TrumpLeaks
0,BreakingNews just put sprinkles on his 2 scoops of ice cream Trumpileaks maga trumptrain potus TrumpLeaks
0,TRANSCRIPT HERE MAGA BuildTheWall BuildThatWall TrumpTrain TrumpTeam TrumpLeaks ComeyDay ComeyHearing
0,TrumpLeaks is like a toddler Everyone knows that you give a child 1 or 2 choices They don t hv the brain capac
0,We are with you Thank you for speaking up and standing up for our principles I will follow you
0,In near dystopian fashion I fall asleep many nights after reading the latest in the diabolical dictatorship TrumpLeaks Comey Murica
0,When he says not even people morals out the window who does that REALLY sound like
0,Exploding Pee Part 1 UrineTime WeCeazy TrumpLeaks
0,Stickman updates RussiaGate in LATEST SONG Please give a listen TheResistance impeachTrump TrumpLeaks Dems
0,READ James Comey s prepared testimony TrumpLeaks Comey
0,Come on reporters Let s make a Russian hooker famous FindHer TrumpRussia TrumpLeaks ComeyTestimony ComeyHearing PeeTape
0,LOL that coming from MAGA who claim they are the victims and call everyone a hypoc
0,B c eventually the good guy always wins realDonaldTrump brace yourself for Comey s testimony TrumpObstructed TrumpLeaks ComeyWeek
0,I d count that as a solid win trumpblocks TrumpLeaks
0,Dershowitz has teamed up w Trump s crisis lawyer Kasowitz
0,Trump right now Comey ComeyHearing ComeyTestimony trumprussia TrumpLeaks potus
0,Scott Dworkin TrumpLeaks Docs Gov John Kasich s super PAC took 250 000 from a pro Putin Ukrainian busi
0,The fact that wld consider giving RussianIntelligence their compounds back says it all
0,Sen McConnell s father in law owns cargo ship that got busted w 90 lbs of cocaine Mitch s wife Trump Transport Sec Elaine Chao TrumpLeaks
0,Another Trump asshole is busted TrumpLeaks Exposes Trump Jr s Russian Speechmaking by
0,RT funder Trump s been racist his entire life These documents we uncovered prove it trumpleaks trumprussia
0,TrumpLeaks Smoking weed Russian handmade Where are the Damn Tapes Trumprussia ComeyTestimony
0,Trump s been racist his entire life These documents we uncovered prove it trumpleaks trumprussiahttps t co nualQ8CnbX Scott Dworkin
0,Retweeted Scott Dworkin funder TrumpLeaks Docs Sen John McCain s super PAC took 200 000 from a pro Putin
0,trumpclimate ComeyHearing ComeyTestimony ImpeachTrump where there s smoke there s fire trumprussia
0,ItMakesMeSmileWhen takes care of biz So glad you re back Comey TrumpObstructed TrumpTweetsComey
0,Not only what is Trump hiding But why is House GOP protecting him Collusion TheResistance Trumprussia
